date;user;text;url
08/02/2018;valentine;Le soir il y a un arrière goût qui revient Et je suis plus mal en 2 Jours Je crois que je préfère le nouveau Levo à l thyroxine ! Je suis vraiment pire en 2 Jours de l thyroxine ! Il y a un arrière goût qui apparaît le soir , genre comme quand on mange un baba au rhum, un peu après on sent le rhume dans son estomac et sa bouche ça chauffe un peu , c’est pareil ! Sauf que c’est le soir !  Mon dieu ! Et la tête qui tourne encore plus depuis 2 Jours .  Bon je vais supporter une semaine , et si j’arrête tout et je prend que du cynomel ?;http://forum.doctissimo.fr/sante/thyroide-problemes-endocrinologiques/resultat-nouveau-traitement-sujet_171688_1.htm
09/02/2018;Chrys;Bonjour valentine , Sans vouloir te vexer ne crois tu pas que tu somatises un peu ? Des séances de yoga ou autre gymnastique douce te seraient d'un grand secours.   ;http://forum.doctissimo.fr/sante/thyroide-problemes-endocrinologiques/resultat-nouveau-traitement-sujet_171688_1.htm
09/02/2018;nouschka;"Le soir il y a un arrière goût qui revient Et je suis plus mal en 2 Jours Je crois que je préfère le nouveau Levo à l thyroxine ! Je suis vraiment pire en 2 Jours de l thyroxine ! Il y a un arrière goût qui apparaît le soir , genre comme quand on mange un baba au rhum, un peu après on sent le rhume dans son estomac et sa bouche ça chauffe un peu , c’est pareil ! Sauf que c’est le soir !  Mon dieu ! Et la tête qui tourne encore plus depuis 2 Jours .  Bon je vais supporter une semaine , et si j’arrête tout et je prend que du cynomel ?</span <span itemprop=""author"" itemscope itemtype=""https://schema.org/Person"" <span itemprop=""name"" hidden valentine</span </span <span itemprop=""url"" hidden http://forum.doctissimo.fr/sante/thyroide-problemes-endocrinologiques/supportez-thyroxine-sanofi-sujet_171008_1.htm#t426944</span </span <span itemprop=""text"" hidden Ben perso, je vais pas prendre de gants comme Chrys qui est une Sainte : je te trouve suante (je reste polie !!) à l'extrême entre ta critique de l'appareil pour passer l'IRM et le fait que tu vas plus mal en DEUX JOURS de nouveau médicament !...";http://forum.doctissimo.fr/sante/thyroide-problemes-endocrinologiques/resultat-nouveau-traitement-sujet_171688_1.htm
09/02/2018;valentine;Pour le irm je me suis renseignée le technicien qui a fait l’examen N’a pas mis les petits coussinets pour caler la tete , d’où les artefacts.ce n’est pas un oubli , il pensait que c’est pour atténuer le bruit , ce qui est faux , si je me sentais un peu mieux , je pourrais même aller exiger un autre irm gratuitement !!!;http://forum.doctissimo.fr/sante/thyroide-problemes-endocrinologiques/resultat-nouveau-traitement-sujet_171688_1.htm
03/07/2019;Vivi4;Bonjour je viens de recevoir mes résultats de TSH U.S après un 4e changement d'extraits thyroidiens merci le levo nouvelle formule!! Sous T Caps depuis 4 mois j'ai une TSH de 0,270 et une T4 LIBRE de 11,9 est ce correct??? merci de vos réponses;http://forum.doctissimo.fr/sante/thyroide-problemes-endocrinologiques/besoin-resultats-analyses-sujet_171632_1.htm
06/07/2019;"scalp2&#039;hel​l";Le plus important c'est comment tu te sens. 0.27 en tout cas ta TSH est freinée. Si tes T4 sont en haut de la norme tu peux essayer les plantes pour mieux convertir;http://forum.doctissimo.fr/sante/thyroide-problemes-endocrinologiques/besoin-resultats-analyses-sujet_171632_1.htm
17/07/2019;Vivi4;Merci de ta réponse !!! Peux tu me dire quelles plantes prendre?? J'avoue que je me trouve mieux surtout le sommeil le seul truc qui m'ennuie c'est que je grossis sans pouvoir gérer mais bon l'important c'est que je me sente mieux!!! Cordialement;http://forum.doctissimo.fr/sante/thyroide-problemes-endocrinologiques/besoin-resultats-analyses-sujet_171632_1.htm
27/07/2019;hallux;Bonjour Il faut mettre les normes du labo à côté de chaque résultat, sans les normes on ne peut rien interpréter.;http://forum.doctissimo.fr/sante/thyroide-problemes-endocrinologiques/besoin-resultats-analyses-sujet_171632_1.htm
27/07/2019;Vivi4;Ok je vais les recherche juste j'ai oublié de dire que je n'avais plus de thyroide depuis plus de 40 ans je suis passée à la NF il y a 2 ans catastrophique!! Puis à l'eutyral j'étais super bien plud de tension pas de problème de poids mais mon endocrino est partie a la retraite et le nouveau a voulu me changer de traitement il m'a donné le Hennin mêmes effets que la NF et ensuite le TCaps à part la prise de poids je me sentais bien mais là ma tension remonte peut-être la chaleur?? Je suis demoralisee j'ai envie de tout envoyer balader et reprendre l'eutyral qui a mauvaise presse mais qui me convient si bien!!! Merci beaucoup de ta réponse !!je recherche mes analyses;http://forum.doctissimo.fr/sante/thyroide-problemes-endocrinologiques/besoin-resultats-analyses-sujet_171632_1.htm
27/07/2019;Vivi4;Bonsoir Hallux Norme TSH U.S 0,358 -3,740....... j'ai 0,27 t4 libre 7,6 -14,6............ j'ai 11,9 je m'aperçois qu'on a oublié la T3 Merci de vos réponses!!;http://forum.doctissimo.fr/sante/thyroide-problemes-endocrinologiques/besoin-resultats-analyses-sujet_171632_1.htm
27/07/2019;hallux;Ta T4 est &amp #034 normale&amp #034  et ta TSH est un peu basse, donc il faudrait voir ta T3. Car normalement si la T4 et la T3 ne sont pas trop hautes, la TSH ne devrait pas être trop basse.;http://forum.doctissimo.fr/sante/thyroide-problemes-endocrinologiques/besoin-resultats-analyses-sujet_171632_1.htm
27/07/2019;Vivi4;Hallux merci de ta réponse mais cela veut il dire que je ne suis pas bien dosée ??;http://forum.doctissimo.fr/sante/thyroide-problemes-endocrinologiques/besoin-resultats-analyses-sujet_171632_1.htm
27/07/2019;hallux;Non pas forcément si ta T3 est normale. Mais on n'en sait rien puisque pas faite.;http://forum.doctissimo.fr/sante/thyroide-problemes-endocrinologiques/besoin-resultats-analyses-sujet_171632_1.htm
28/07/2019;Vivi4;Hallux j'abuse encore mais je me pose une question la mauvaise réputation de l'EUTYRAL est elle justifiée ?? Un endocrino me l'avait prescrit et 2 endicrinos. me l'ont supprimé, un très brutalement et je ne l'ai pas écouté et le dernier plus modéré et courtois qui m'a passé au Tcaps. Merci pour ta patience!! Cordialement;http://forum.doctissimo.fr/sante/thyroide-problemes-endocrinologiques/besoin-resultats-analyses-sujet_171632_1.htm
29/07/2019;hallux;Les médecins ne prescrivent que des traitements à base de T4 seule pour traiter les patients en hypothyroidie. Ils ne regardent presque jamais le dosage de la T3 sauf si une hyperthyroidie est suspectée. Quant à prescrire un traitement contenant à la fois de la T4 et de la T3 comme Euthyral ou Cynomel + Levothyrox, ils sont très peu à le faire car la prise de T3 fait fortement chuter la TSH. De plus ils ne savent pas gérer ce traitement, on voit des patients dont le médecin a bien voulu leur prescrire de l'Euthyral mais qui ne font même pas doser la T3 libre ou qui continuent à se fier uniquement à la TSH comme pour les patients qui prennent un traitement T4 seule. Du coup ils disent que le patient est en surdosage parce que sa TSH est trop basse. Alors que si la T4 et la T3 libres sont correctes sans être trop hautes dans les normes, on ne peut pas dire qu'il y a surdosage. Perso je prends du Novothyral 75 (= 75 mcg de T4 + 15 mcg de T3), c'est allemand. J'en prends un demi comprimé + 62,5 mcg d'Euthyrox. En général il faut combiner l'Euthyral ou le Novothyral avec du Levothyrox ou du L-Thyroxin ou de l'Euthyrox. Parce que l'Euthyral contient une proportion de T3 trop forte par rapport à la T4.;http://forum.doctissimo.fr/sante/thyroide-problemes-endocrinologiques/besoin-resultats-analyses-sujet_171632_1.htm
29/07/2019;Vivi4;Bonsoir Hallux C'est un peu compliqué pour moi mais je me souviens qu'il y a 40 ans quand j'ai débuté mon hypothyroidie l'endocrinologue de l'époque me donnait des extraits thyroïdiens choay plus de l'euthyral jusqu'au jour où l'extrait thyroïdien comme le levo a été brusquement supprimé et comme j'ai déménagé le nouvel endicrino m'a supprimé l'eutyral pour ne prendre que du levo. Normalement je prenais un jour 125 / un jour 150 Si je veux faire comme toi avec le tcaps et l'euthyral sachant qu'aujourd'hui le prends un jour 137 un jour 150 de tcaps quelle dose de tcaps et d&amp #034 euthyral devrais je prendre?? Merci beaucoup de tes reponses Cordialement;http://forum.doctissimo.fr/sante/thyroide-problemes-endocrinologiques/besoin-resultats-analyses-sujet_171632_1.htm
30/07/2019;hallux;Je t'envoie un mp, on ne peut pas parler de ça ici.;http://forum.doctissimo.fr/sante/thyroide-problemes-endocrinologiques/besoin-resultats-analyses-sujet_171632_1.htm
30/07/2019;Vivi4;Merci beaucoup!!!;http://forum.doctissimo.fr/sante/thyroide-problemes-endocrinologiques/besoin-resultats-analyses-sujet_171632_1.htm
30/07/2019;Susanne in F;Wow , Vivi , tu as pris du Choay ! Tu es donc un de ces ancien temoins qui ont connu ca . Je t'inviterais sur mon forum , mais c'est pas possible en ce moment . Je commence en haut . D'abord le T Caps n'est pas de l'extrait thyroidien mais de la T4 synthetique . Le Choay etait de l'extrait thyroidien . Ca existe toujours , dans presque tous les pays du monde , en France l'industrie pharmaceutique a reussi à l'interdire . Pour la T4 il faut savoir de quelle unité de mesure il s'agit , comme ca ca ne veut rien dire . La TSH on s'en fout . Si tu te sentais super bien sous Euthyral il faudrait peut etre aller voir un bon medecin pour que tu ais de nouveau le medicament qui te convient le mieux . Tu habites ou ? Hallux a deja bien decrit comment fonctionnent les medecins qui ne s'y connaissent pas en hormones . Il y en a aussi qui s'y connaissent . t4 libre 7,6 -14,6............ j'ai 11,9 C'est quelle untité de mesure ca ? Ca me rappelle fortement cette norme fausse qui traine dans certains labos en France .;http://forum.doctissimo.fr/sante/thyroide-problemes-endocrinologiques/besoin-resultats-analyses-sujet_171632_1.htm
30/07/2019;Vivi4;Oh la la quel bonheur d'entendre que je choay existe encore en France ils l'avaient brusquement&amp #034  supprimé comme l'ancienne formule du levo d'ailleurs!! J'etais tellement bien dosée choay +euthyral mon poids était stable je ne ressentait aucun effet secondaire. Après on m'a prescrit le levo et à part une prise de poids progressive tout allait bien. Avec le levier NF les ennuis ont commencé moi qui jusque-là avait une tension avoisinant les 10 je me suis retrouvée à l'hôpital à plus de 20 je n'arrivais plus à grimper un escalier, pour me relever de ma chaise je le faisais à la force de mes bras car mes genoux me faisaient souffrir, grosse fatigue je ne dormais plus un état d'angoisse des envies de pleurer en permanence, mon cholestérol c'est mis à grimper en flèche .... Rien qu'à l'idée de retrouver les extraits thyroïdiens choay et mon ancien traitement je suis entrain de revivre😉 y en a t il toujours en Espagne?? Merci pour ta réponse !!!;http://forum.doctissimo.fr/sante/thyroide-problemes-endocrinologiques/besoin-resultats-analyses-sujet_171632_1.htm
30/07/2019;hallux;Pas en France, Susanne a dit que ça existe encore mais pas en France.;http://forum.doctissimo.fr/sante/thyroide-problemes-endocrinologiques/besoin-resultats-analyses-sujet_171632_1.htm
30/07/2019;Vivi4;Bonsoir Hallux J'ai vu sur internet en Allemagne et au Canada!! j'en profite pour te demander si le Tcaps synthétique est aussi efficace que la thyroxine naturelle. l'euphorie passée je me dis que ça fait la 5e fois que je change de traitement avec les désagréments que ça comporte si tu me dis que le Tcaps est aussi efficace que l'autre après mes analyses il vaut mieux que j'en reste là!!!  ;http://forum.doctissimo.fr/sante/thyroide-problemes-endocrinologiques/besoin-resultats-analyses-sujet_171632_1.htm
30/07/2019;hallux;Je ne connais pas le traitement dont vous parlez avec Susanne. Si c'est de la thyroïde naturelle ça contient de la T4 et de la T3 et d'autres hormones thyroïdiennes. Le Tcaps est une hormone synthétique avec T4 seulement, comme le Levothyrox, avec d'autres excipients. On ne peut donc pas comparer les hormones naturelles et les synthétiques.;http://forum.doctissimo.fr/sante/thyroide-problemes-endocrinologiques/besoin-resultats-analyses-sujet_171632_1.htm
31/07/2019;Vivi4;Bonjour Hallux C'était mon 1e traitement où tout était parfait dommage pour moi ils l'ont supprimé du jour au lendemain!! Je vais faire comme tu me dis en septembre je ferai mon analyse et on verra à ce moment là. Le seul effet secondaire du tcaps qui me désole beaucoup c'est que je grossis sans pouvoir gérer mais à part ça chose incroyable depuis longtemps je suis bien moralement et c'est important car j'ai vraiment touché le fond.ma tension monte un peu mais bon!! Tu écoutes et tu conseilles tout le monde c'est magnifique mais j'espère que toi tu vas bien!! Merci pour tout!!!!;http://forum.doctissimo.fr/sante/thyroide-problemes-endocrinologiques/besoin-resultats-analyses-sujet_171632_1.htm
31/07/2019;hallux;Quel dommage que tu aies du interrompre brutalement un traitement qui te convenait bien ! Quant à moi je vais à peu près bien, mais j'ai de temps à autre des périodes pas terribles depuis mon embolie pulmonaire de décembre 2017. Cette embolie m'a causé des soucis cardiaques, m'obligeant à prendre un traitement pour le coeur.;http://forum.doctissimo.fr/sante/thyroide-problemes-endocrinologiques/besoin-resultats-analyses-sujet_171632_1.htm
31/07/2019;Vivi4;Oh désolée pour toi!! Tu t'occupes à nous réconforter alors que tu as des problèmes plus lourds ue les nôtres !!! Tu es une bonne personne Hallux!!! Vraiment merci!!! Prends soin de toi!!! Je reviendrai vers toi plus tard;http://forum.doctissimo.fr/sante/thyroide-problemes-endocrinologiques/besoin-resultats-analyses-sujet_171632_1.htm
08/04/2019;bbaxel;Bonjour,ma mère a fait une prise de sang ce matin car elle est très fatiguée et n’arrive pas à perdre du poids.Quelqu’un pourrait-il m’aider svp? merci;http://forum.doctissimo.fr/sante/thyroide-problemes-endocrinologiques/interpretation-resultats-sujet_171695_1.htm
08/04/2019;bbaxel;Pas de contenu;http://forum.doctissimo.fr/sante/thyroide-problemes-endocrinologiques/interpretation-resultats-sujet_171695_1.htm
08/04/2019;bbaxel;Je n’arrive pas a poster sans que ce soit trouble;http://forum.doctissimo.fr/sante/thyroide-problemes-endocrinologiques/interpretation-resultats-sujet_171695_1.htm
08/04/2019;bbaxel;Personne ?;http://forum.doctissimo.fr/sante/thyroide-problemes-endocrinologiques/interpretation-resultats-sujet_171695_1.htm
09/04/2019;Miss94200;Bonjour Il manque le T3 sur la partie endocrinologie sans le dosage du T3 ça va être compliqué pour les autres intervenants de te dire si ta mère est en hypo ou hyper.;http://forum.doctissimo.fr/sante/thyroide-problemes-endocrinologiques/interpretation-resultats-sujet_171695_1.htm
09/04/2019;bbaxel;Bonjour et merci de votre réponse.C’est son médecin généraliste qui lui a prescrit les analyses.;http://forum.doctissimo.fr/sante/thyroide-problemes-endocrinologiques/interpretation-resultats-sujet_171695_1.htm
09/04/2019;Miss94200;Oui ça c est sur mais il faut voir le dosage T3 :);http://forum.doctissimo.fr/sante/thyroide-problemes-endocrinologiques/interpretation-resultats-sujet_171695_1.htm
09/04/2019;Susanne in F;Je dirais que c'est une grosse hypo , mais on voit très mal . Quand on clique sur la photo ca dit qu'on n'a pas le droit , pas moyen de voir plus grand . Tu peux pas l'ecrire comme ca ? T4 pmol/l ...... impossible à lire , mais c'est un seul chiffre avant la virgule , alors gros problème ! Mais ecris le sur le forum !;http://forum.doctissimo.fr/sante/thyroide-problemes-endocrinologiques/interpretation-resultats-sujet_171695_1.htm
09/04/2019;bbaxel;"Je dirais que c'est une grosse hypo , mais on voit très mal . Quand on clique sur la photo ca dit qu'on n'a pas le droit , pas moyen de voir plus grand . Tu peux pas l'ecrire comme ca ? T4 pmol/l ...... impossible à lire , mais c'est un seul chiffre avant la virgule , alors gros problème ! Mais ecris le sur le forum !</span <span itemprop=""author"" itemscope itemtype=""https://schema.org/Person"" <span itemprop=""name"" hidden Susanne in F</span </span <span itemprop=""url"" hidden http://forum.doctissimo.fr/sante/thyroide-problemes-endocrinologiques/besoin-resultats-analyses-sujet_171632_1.htm#t430681</span </span <span itemprop=""text"" hidden Merci à vous.Voici les résultats : T4L: 7,2 ng/L norme 6,1 a 11,2 soit 9,3 pmol /L. TSH us 3,88 muI/L norme 0,38 a 5,33. Auriez-vous également un bon endocrinologue dans la région parisienne ? Car son medecin généraliste lui a dit que tout était parfait   merci";http://forum.doctissimo.fr/sante/thyroide-problemes-endocrinologiques/interpretation-resultats-sujet_171695_1.htm
09/04/2019;Susanne in F;C'est ce que je pensais , une grosse hypo . La T4 devrait etre au moins à 17 , elle est 9 ...... ! La TSH devrait etre au maximum à 1,5 ....... elle est à 3,8 ........ ! Effectivement &amp #034 tout va bien&amp #034  ! La T3 manquante montre que le medecin n'y connait rien , il n'est meme pas capable de tester correctement . Pour un problème hormonal il faut aller chez un specialiste en hormones . Les endocrinologues sont les specialistes du diabète .;http://forum.doctissimo.fr/sante/thyroide-problemes-endocrinologiques/interpretation-resultats-sujet_171695_1.htm
09/04/2019;bbaxel;"C'est ce que je pensais , une grosse hypo . La T4 devrait etre au moins à 17 , elle est 9 ...... ! La TSH devrait etre au maximum à 1,5 ....... elle est à 3,8 ........ ! Effectivement &amp #034 tout va bien&amp #034  ! La T3 manquante montre que le medecin n'y connait rien , il n'est meme pas capable de tester correctement . Pour un problème hormonal il faut aller chez un specialiste en hormones . Les endocrinologues sont les specialistes du diabète .</span <span itemprop=""author"" itemscope itemtype=""https://schema.org/Person"" <span itemprop=""name"" hidden Susanne in F</span </span <span itemprop=""url"" hidden http://forum.doctissimo.fr/sante/thyroide-problemes-endocrinologiques/besoin-resultats-analyses-sujet_171632_1.htm#t430691</span </span <span itemprop=""text"" hidden Auriez-vous quelqu’un à nous conseiller ? Merci";http://forum.doctissimo.fr/sante/thyroide-problemes-endocrinologiques/interpretation-resultats-sujet_171695_1.htm
09/04/2019;Miss94200;"C'est ce que je pensais , une grosse hypo . La T4 devrait etre au moins à 17 , elle est 9 ...... ! La TSH devrait etre au maximum à 1,5 ....... elle est à 3,8 ........ ! Effectivement &amp #034 tout va bien&amp #034  ! La T3 manquante montre que le medecin n'y connait rien , il n'est meme pas capable de tester correctement . Pour un problème hormonal il faut aller chez un specialiste en hormones . Les endocrinologues sont les specialistes du diabète .</span <span itemprop=""author"" itemscope itemtype=""https://schema.org/Person"" <span itemprop=""name"" hidden Susanne in F</span </span <span itemprop=""url"" hidden http://forum.doctissimo.fr/sante/thyroide-problemes-endocrinologiques/besoin-resultats-analyses-sujet_171632_1.htm#t430691</span </span <span <span itemprop=""url"" hidden http://forum.doctissimo.fr/sante/thyroide-problemes-endocrinologiques/besoin-resultats-analyses-sujet_171632_1.htm#t430693</span </span <span itemprop=""text"" hidden Tu es de quel coin en région parisienne?je peux te recommander la mienne";http://forum.doctissimo.fr/sante/thyroide-problemes-endocrinologiques/interpretation-resultats-sujet_171695_1.htm
09/04/2019;bbaxel;Maisons lafitte;http://forum.doctissimo.fr/sante/thyroide-problemes-endocrinologiques/interpretation-resultats-sujet_171695_1.htm
09/04/2019;Miss94200;Ca fait un bout quand même elle est dans le val de Marne l endocrinologue que je consulte;http://forum.doctissimo.fr/sante/thyroide-problemes-endocrinologiques/interpretation-resultats-sujet_171695_1.htm
09/04/2019;bbaxel;Merci à vous;http://forum.doctissimo.fr/sante/thyroide-problemes-endocrinologiques/interpretation-resultats-sujet_171695_1.htm
19/05/2019;bbaxel;Bonjour,ma mère a fait analysé la T3 en complément des résultats d’analyses au début du poste :2,91 ng/l. Norme 2,50 a 3,90. Quels sont vos avis ? Merci;http://forum.doctissimo.fr/sante/thyroide-problemes-endocrinologiques/interpretation-resultats-sujet_171695_1.htm
19/05/2019;Jlouis;La prise de sang est normale et doser la T3 n'était pas nécessaire 🙄. La fatigue de ta maman est due à autre chose. Tu as demandé un conseil : ne demande pas à des personnes sans connaissances médicales d'interpréter des résultats de prise de sang ou quoi que soit. Ton médecin généraliste est bien, tu peux lui faire confiance.;http://forum.doctissimo.fr/sante/thyroide-problemes-endocrinologiques/interpretation-resultats-sujet_171695_1.htm
19/05/2019;Jlouis;Et à priori, selon ce que est mesuré dans l'analyse sanguine, la fonction hépatique est normale.;http://forum.doctissimo.fr/sante/thyroide-problemes-endocrinologiques/interpretation-resultats-sujet_171695_1.htm
19/05/2019;Jlouis;Petit rappel : poser un diagnostic médical sans être médecin, dentiste ou sage-femme est un exercice de illégale de la médecine, et des sanctions pénales peuvent être encourues.;http://forum.doctissimo.fr/sante/thyroide-problemes-endocrinologiques/interpretation-resultats-sujet_171695_1.htm
27/07/2019;Lindsey;Bonjour besoin de votre aide Suzanne. Je suis traite depuis l age de 12ans pour une hypothyroidie je suis passé par lthyroxine euthyrox qui ne me convenait pas ,lthyrone m a convenu manque de bol enleve du marcher.je suis donc depuis 2ans sous euthyral mais depuis 1mois ca ne va plus deprime angoisse anxiete fatigue énorme cycle allonge de 26 à 31jours syndrome premendtruel plus fort perte de cheveux etc en mai je le sentais bien ma T4 etait a 15.6 norme 11.60 a 21.90 T3 etait a 6 norme max 4.4 Tsh 0.26 norme 0.23 a 4.20 Avec euthyral prit avant la pds. Ensuite .les symotom3 hypo sont progressivement arrivés puis là je suis au bout du rouleau... j'ai refait une pds avec euthyral prit avant t4 a 11.8norme 9 à 19 T3 a 5.83norme 2.63a 5.70 Tsh a 0.48 norme 0.35 a 4.94 Puis on m a dit sous euthyral on ne le prend avant la pds étant aujourd hui encore mal j ai donc été la faire sans l euthyral T4 a 10.8 norme 9a19 T3 a 3.58 norme 2.63a5.70 Tsh a 0.31 norme 0.35a4.94. Je sais que sous euthyral on ne regarde pas à la tsh ...je suis à 3/4 euthyral je sens que q Je suis en hypo j ai un endo qui n entends rien il est a côté de la plaque je oensais augmenter de 1/4 pour retrouver une t4 a 15 et t3 un peu plus haute comme en mai que me conseillez vous ? Merci pour votre en aide je pense bien voir un endo compétent mais c dur de trouver peut le dr clayes ps c lui qui m a donne euthyral mais étant cher ces consultations je suis alle chez un endo pres de chez moi.;http://forum.doctissimo.fr/sante/thyroide-problemes-endocrinologiques/interpretation-resultats-sujet_171695_1.htm
28/07/2019;hallux;Bonjour Tu prenais combien de L-Thyroxin ou d'Euthyrox juste avant de passer à l'Euthyral ? Quels étaient tes résultats TSH, T4 et T3 libres avec cette dose de traitement ? Il faut faire attention lorsqu'on prend de l'Euthyral seul car il est fort dosé en T3 par rapport à la T4. On peut alors se retrouver au bout de quelques semaines ou mois avec soit une T4 trop basse, soit une T3 trop haute. C'est pour cela que l'on combine l'Euthyral avec de la T4 (Levothyrox ou L-Thyroxin ou Thyrofix). Actuellement on voit qu'avec 3/4 d'Euthyral ta T4 est trop basse. Si tu passe à 1 Euthyral entier tu risques d'avoir une T3 trop haute, pas forcément dans un ou deux mois mais peut-être trois ou quatre mois. Pour la T3 il n'est pas forcément bon qu'elle soit haute dans la norme, cela peut causer des soucis niveau cardiaque. Vois avec ton médecin pour compléter ton 3/4 d'Euthyral avec un peu de T4, par exemple 12,5 µg de L-Thyroxin ou de Levothyrox ou de Thyrofix (donc de la T4).;http://forum.doctissimo.fr/sante/thyroide-problemes-endocrinologiques/interpretation-resultats-sujet_171695_1.htm
28/07/2019;hallux;Et j'ai oublié de dire qu'effectivement on ne prend pas son traitement thyroïde avant la prise de sang, mais juste après. Que ce soit pour Euthyral ou Levothyrox ou autre. Car sinon les taux de T4L et T3L seront plus hauts car on sera en pic hormonal après la prise du traitement. Donc ne prenez pas votre traitement thyroïde avant le prélèvement mais après.;http://forum.doctissimo.fr/sante/thyroide-problemes-endocrinologiques/interpretation-resultats-sujet_171695_1.htm
22/07/2019;Carole2A;Bonjour, est ce que quelqu un peut m éclairer sur mes résultats ? T3L : 4,02 pg/ml normes:(2.50/3.90) 6,2 pmol/l normes:(3.83/5.97) T4L : 0,88ng/dl normes:(0.61/1.12) 11.3pmol normes:(7.83/14.38) TSH : 1.33ul/ml normes:(0,40/3,50) AC ANTI-THYROPEROXYDASE : 0,3ul/ml normes: &amp lt 9 AC-ANTI-THYROGLOBULINE : &amp lt 0,9ul/ml normes : &amp lt 4 J ai rdv demain avec mon médecin pour voir tout ça, mais comme c est un bon vieux médecin de famille, qui dit toujours que tout va bien, j aimerai vos avis, Merci bonne journée à tous;http://forum.doctissimo.fr/sante/thyroide-problemes-endocrinologiques/avis-taux-sujet_171681_1.htm
