date;user;text;url
29/04/2019;eleonore17​5;Bonjour Docte, Voilà j'ai eu mes résultats d'analyse de trak ce matin, ils ont augmenté. ils sont à 7 ui/l positif&amp gt 3,3 j'étais à 5,6 auparavant. Je n'y comprends plus rien. je vais donc continuer Néomercazole 5 mg. je verrai à mon retour de vacances. Bonne journée. Eleonore;http://forum.doctissimo.fr/sante/thyroide-problemes-endocrinologiques/probleme-couple-tyroide-sujet_152716_1.htm
01/05/2019;docte;Bonjour Eleonore, Les trak n'étant pas normalisés le diagnostic de Basedow peut être retenu, mais il est atypique (beaucoup d'anti-tpo et peu de trak). Comme de faibles doses de néomercazole ont été rapidement efficaces, il vaudrait peut-être mieux en garder une bonne dose (10mg/j) et commencer les hormones thyroïdiennes selon la méthode combinée (&amp #034 frein+accélerateur&amp #034  du lien du post précédant). Dans votre cas, 12 mois de néomercazole ont toute chance d'apporter la guérison. Bon courage!;http://forum.doctissimo.fr/sante/thyroide-problemes-endocrinologiques/probleme-couple-tyroide-sujet_152716_1.htm
21/05/2019;eleonore17​5;Bonjour Docte, Merci pour votre réponse. Je rentre aujourd'hui de vacances et j'ai fait une analyse de ma TSH ce matin. Comme j'ai ressenti des difficultés à respirer la semaine dernière, j'ai diminué de moi même le Néomercazole. je prends donc 2,5mg de NM depuis le 15 Mai, soit 7 jours. Ma TSH aujourd'hui est : 0,54 mUI/l NORME 0,38 à 5,33 Je vois mon médecin demain.J'espère qu'il me fera analyser les trak car je pense qu'ils ont du augmenter. selon vos conseils,et l'analyse des trak, il faudrait peut être prendre 10 mg de NM et 12,5 mg de L throxine. je vais voir ce qu'en dis mon médecin demain. Merci pour vos réponses qui me confortent. Eleonore;http://forum.doctissimo.fr/sante/thyroide-problemes-endocrinologiques/probleme-couple-tyroide-sujet_152716_1.htm
27/05/2019;eleonore17​5;Bonjour Docte, j'ai vu mon medecin avec les résultats de mes analyses: il considère qu'avec une TSH à 0,54 mUI/l NORME 0,38 à 5,33, je suis maintenant en Euthyroidie, et que je dois continuer le NM 2,5mg. En ce qui concerne les Trak , il pense à une régularisation au long terme, sur les 18 mois de traitement. je suis dubitative, j'ai toujours mes &amp #034 coups de chaud&amp #034  la nuit et parfois le jour. De plus le traitement au NM me donne des douleurs articulaires et musculaires, et un &amp #034 doigt ressaut&amp #034 . j'ai peur de retomber en hyperthyroidie.. j'ai une nouvelle prise de sang a faire dans 15 jours. j'ai pris un rv chez un Endocrinologue en juin. qu'en pensez vous? Merci Eleonore;http://forum.doctissimo.fr/sante/thyroide-problemes-endocrinologiques/probleme-couple-tyroide-sujet_152716_1.htm
30/05/2019;docte;Bonsoir Eleonore, Votre Basedow est décidément atypique. Contrôlé par seulement 2,5 mg de NM, autant dire rien. Passer d'une tsh de 16 à 0,5 en quelques semaines ne me paraît pas très bon et je pense que l'endocrinologue va reprendre le traitement en main. En effet, le NM représentant le traitement &amp #034 anti-Basedow&amp #034 , il ne faut pas modifier rapidement sa posologie. Sur les trak, on n'est pas pressé, et si une euthyroïdie stable est obtenue on peut effectivement attendre 1 an avant de les contrôler. Avant, il faut s'appuyer sur T4L (hyperthyroïdie) ou tsh (hypothyroïdie). Pour les autres symptômes, on a peut-être affaire à un problème rhumatismal, ce qui est fréquent en cas de Basedow et un avis rhumato me paraît bienvenu. Bon courage!;http://forum.doctissimo.fr/sante/thyroide-problemes-endocrinologiques/probleme-couple-tyroide-sujet_152716_1.htm
04/06/2019;eleonore17​5;Bonsoir Docte, Vous avez raison, c'est un basedow vraiment atypique. Résultats ce matin Tsh 0,04.Effectivement j'avais encore des &amp #034 coups de chaud&amp #034  et surtout mal à la gorge, donc pas étonnant. Me voici repartie à la case départ! j'ai repris dès aujourd'hui 2,5mg de NM, demain je prendrai 5 mg. Mon rendez-vous chez l'endocrinologue est le 21 juin.. ce qui est étonnant c'est que les écho indiquent plutôt une thyroidite type hashimoto et que j'ai beaucoup plus d'anticorps anti thyroperoxydase. Bon, on verra bien... Bonne soirée. Eleonore;http://forum.doctissimo.fr/sante/thyroide-problemes-endocrinologiques/probleme-couple-tyroide-sujet_152716_1.htm
22/06/2019;eleonore17​5;Bonjour Docte, je vous donne quelques nouvelles suite à ma visite chez l'endocrinologue. Il m'a dit la même chose que vous, c'est à dire que lui même au départ n'aurait pas donné de traitement, mais maintenant il me laisse sous NM 10mg et me refait faire des examens très complets pour y voir plus clair et me compléter le traitement par la suite. il précise qu'au vu des échographies j'ai bien une thyroide rabougrie qui nécessite un traitement à la thyroxine. j'espère qu'il me donnera L thyroxine plutôt que levothyrox. qu'en pensez-vous? Merci encore pour votre analyse et vos conseils. Cordialement Eleonore;http://forum.doctissimo.fr/sante/thyroide-problemes-endocrinologiques/probleme-couple-tyroide-sujet_152716_1.htm
25/06/2019;eleonore17​5;Bonjour Docte, je viens d'avoir mes résultas, je vous les communique , maintenant sous NM 10 mg. Tsh 0,23 0,38 à 5,33 t4 7,4 6,1 à 11,2 t3 2,99 2,5 à 3,9 trak 4,3 positif&amp gt 3,3 Bonne journée. Eleonore;http://forum.doctissimo.fr/sante/thyroide-problemes-endocrinologiques/probleme-couple-tyroide-sujet_152716_1.htm
18/07/2019;eleonore17​5;Bonjour Docte, je vous communique mes derniers résultats en espérant votre avis sur ceux-ci. Je suis donc sous Néomercazole 5 mg depuis le 4 juin sans changement. le 15 juillet: tsh 1,42 mui/l 0.38 à 5.33 t4 5,9 ng/l 6.1 à 11,2 t3 2,79 ng/l 2,50 à 3.90 antirecepteurs de la Tsh 3,1 iu/l negatif&amp lt 2.9 equivoque 2.9 à 3,3 Mes trak on bien baissé mais mes t4 son trop faibles maintenant. pensez-vous que je sois dans un réel cas d'hyperthyroidie? bien que l'echographie indiquait thyroidite d'hashimoto? Merci pour votre réponse,j'aimerai beaucoup avoir votre avis. Bonne journée. Eleonore;http://forum.doctissimo.fr/sante/thyroide-problemes-endocrinologiques/probleme-couple-tyroide-sujet_152716_1.htm
27/07/2019;hallux;Bonjour Je ne m'y connaît pas trop en TRAK mais je peux dire que tes derniers résultats ne montrent pas d'hyperthyroïdie car ta T4 est trop basse et ta T3 est normale. Si tu étais en hyper les T4 et(ou) T3 seraient trop hautes, ce n'est pas le cas.;http://forum.doctissimo.fr/sante/thyroide-problemes-endocrinologiques/probleme-couple-tyroide-sujet_152716_1.htm
06/08/2019;eleonore17​5;Merci Hallux pour ta réponse, Effectivement je suis plutôt en hypo maintenant.Mon endocrinologue, au vu de mes résultats du 15 juillet m'a baissé mon traitement Néomercazole à 2,5mg. J'avais consulté pour une perte de poids, je n'ai pas vraiment de symptômes et j'ai repris 4 kg. Mon endocrinologue me revoit en septembre et avisera avec mes nouveaux résultats... pour ma part, je ne comprends pas bien mes résultats avec une prise de NM aussi faible et suis tentée d'arrêter le traitement car j'ai peur de prendre trop de poids du coup. Merci encore de m'avoir répondu. Eleonore;http://forum.doctissimo.fr/sante/thyroide-problemes-endocrinologiques/probleme-couple-tyroide-sujet_152716_1.htm
06/09/2019;eleonore17​5;Bonjour, je reviens sur le forum pour vous donner mes nouveaux résultats, les voici TSH 1,61 0,38 à 5,33 T4L 6,7 6,1 à 11,2 T3L 3,21 2,50 à 3,90 Mes résultats semblent dans la norme, bien que ces derniers temps j'ai ressenti une très grande nervosité ainsi que des &amp #034 coups de chaud&amp #034  signes plutôt d'une hyperthyroidie. je suis toujours sous néomercazole 2,5mg, les track n'ont pas été mesurés. qu'en pensez vous? Puis je arrêter le traitement lorsque les Track seront devenus négatifs?? Merci de votre aide.;http://forum.doctissimo.fr/sante/thyroide-problemes-endocrinologiques/probleme-couple-tyroide-sujet_152716_1.htm
22/09/2019;eleonore17​5;Bonjour Docte, bonjour Hallux. sans réponse, je reviens vers vous. j'ai eu un nouveau rv avec mon endocrinologue qui se dit satisfait des résultats. Il m'a fait une ordonnance pour les anticorps pour le prochain rv, et avisera en fonction. Mais une chose que je ne comprends pas, j'ai toujours des sensations de chaud qui me gênent et il les attribue à la ménopause ?? d'autre part j'ai une thyroide toute petite qui se rétrécie donc ( au vu de 2 échographies à 2 ans d'intervalle) et mes résultats ne nécessitent pas de Lévothyrox... Pourriez-vous me l'expliquer? Merci encore pour votre aide. Eleonore;http://forum.doctissimo.fr/sante/thyroide-problemes-endocrinologiques/probleme-couple-tyroide-sujet_152716_1.htm
01/10/2019;eleonore17​5;Bonsoir, Plus de réponses à mes questions? Je vais donc rester avec mes interrogations.....;http://forum.doctissimo.fr/sante/thyroide-problemes-endocrinologiques/probleme-couple-tyroide-sujet_152716_1.htm
16/11/2019;eleonore17​5;Bonjour, je lance une bouteille à la mer ... je viens d'avoir mes résultats de prise de sang aujourd'hui. tsh 3,36 norme 0.38 à 5.33 t4l 6,6 6,1 à 11,2 t3l 3,5 2,50 à 3,90 anti recépteur tsh 2,89 norme nouveau labo &amp lt 1,75 ( norme ancien labo 2,9 à 3,3) le laboratoire effectuant l'analyse des anticorps ayant fermé m'a t on dit (il ne reste que 2 labo /3), je me retrouve avec un taux que je ne peux plus comparer!!! Ne pouvant plus suivre décemment mes résultats j'ai donc décidé, outre ce qu'en pensera mon endocrinologue que je vois lundi 18/11, d'arrêter mon traitement de néomercazole 2,5mg. Comme il y avait un doute sur l'application ou pas du traitement dans mon cas (atypique) La confiance n'étant plus là!! trop c'est trop!! A vous lire Eleonore;http://forum.doctissimo.fr/sante/thyroide-problemes-endocrinologiques/probleme-couple-tyroide-sujet_152716_1.htm
16/11/2019;hallux;Bonjour A ta place, je n'arrêterai pas un traitement sans avis médical. Les anti récepteurs de la TSH sont au-dessus de la norme donc peut-être as-tu besoin de continuer le traitement. Par contre, si ton taux de T4L reste bas, il faudra voir s'il ne faut pas ajouter à ton traitement un peu d'hormones thyroïdiennes pour compenser. Cela dit je ne connais pas trop les problèmes d'hyperthyroïdie ou de Basedow, donc ce que je dis là est à prendre avec précaution. Le mieux serait d'aller voir ton endocrino pour qu'il te dise quoi faire. Et prendre un avis chez un autre médecin si tu n'as plus confiance.;http://forum.doctissimo.fr/sante/thyroide-problemes-endocrinologiques/probleme-couple-tyroide-sujet_152716_1.htm
21/04/2006;fay41ft;Moi sa fais 1 ans que je vis avec mon amie ... Et encore Hier on c est Disputer et elle voulait me quitter ... Elle souffre de la Tyroïde. Je crois que l on ne parle pas assez du problème de couple lié au problème de Tyroïde (Magazine, Forum, spécialiste ...). D ailleurs, je fais appel à toute les personne qui souffre de la Tyroïde et qui éprouve des difficultés dans leur couple lié a cette putain de Maladie !! A apporter leurs témoignage. Ainsi que les personnes qui subissent les l'irritabilités de son compagnon souffrant de la tyroïde ...   Tous d'abord il ne faut pas oublier que la personne qui te crie dessus, qui te vois comme son pire ennemi, qui peu avoir même envie de te quitter en te souhaitant tous les malheur du monde, est avant tous une personne qui souffre, qui éprouve un mal être, et qui est totalement déboussoler. Je sais ce n est pas facile a accepter car tu te dis: &amp #034  mais si il ou elle m aimer il ou elle ne serait pas comme sa !! &amp #034      Je te comprend mais la première chose a faire pour toi c est que tu te mette en tête que tous ce qui se passe est du a se dysfonctionnement de sa glande et non pas de son coeur car dis toi qu il serait 1000 fois plus facile pour toi de l accepter que pour elle qui dois déjà assumer cette maladie et ces symptômes et je te parle même pas des effet secondaire du au levothyrox.Pour toi il te faudra patience et courage et te dire peut être dans ton histoire l amour serat plus fort que tous ...   Pour toi personne qui souffre de cette maladie je te conseille de prendre conscience qu il faut que tu combatte cette maladie dans tous ces angles et que surtout que tu l accepte et ceci se fera par un combat d abord contre toi même. Il faut que tu sois courageuse et que tu explique a ton compagnon après l avoir compris toi même que ce n est pas facile pour toi et que tu a besoin de patience et d amour de la part de celui-ci. Mais il ne faut surtout pas que tu laisse ta moitié dans l ignorance et culpabiliser parce que il ne faut pas croire que tu es toute seule a subir ce problème car vivre avec une personne que l on aime du plus profond de sois même c est partager ces souffrance, ces joies au quotidien ...   Pour ma part aujourd huit je souffre beaucoup de cette situation, je ne sais même pas si mon couple ira très loin, mais tous se que je sais c est que je l aime du fond du coeur ... j ignore si on arriveras a nous défaire de toute ces dispute je me sens perdu ... mais je sais que ce que j éprouve se n est rien par rapport a mon amie ou ceux qui souffre de la Tyroïde ...   Voila j espère que mon témoignage aura utilité et que cela apportera des réponse a beaucoup de question posé ... je souhaite bon courage a tous et n oublié pas &amp #034 la vie est un combat d abord contre soi même &amp #034  Courage ... Amour ... Perceverance sont les clef du sucée  Ps : Si tu lis sa un jour et que nos chemins se sont séparé sache que je t aime ...  ;http://forum.doctissimo.fr/sante/thyroide-problemes-endocrinologiques/probleme-couple-tyroide-sujet_152716_1.htm
21/04/2006;ale09me;Pourquoi ne pas lui ouvrir ton coeur et lui dire tout ça de vive voix, ou lui redire si tu l'as déjà fait? Bon courage à toi!  ;http://forum.doctissimo.fr/sante/thyroide-problemes-endocrinologiques/probleme-couple-tyroide-sujet_152716_1.htm
24/04/2006;fay41ft;...;http://forum.doctissimo.fr/sante/thyroide-problemes-endocrinologiques/probleme-couple-tyroide-sujet_152716_1.htm
27/04/2006;ros73yt;Bonjour fays, quelle maladie a ta compagne ? basedow, je suppose ? Hyperthyroïdie ? Oui c'est difficile pour l'entourage mais les maladies de la thyroïde se soignent donc cet état ne peut être que passager. ça ne vaut pas le coup de mettre en cause son couple pour ça. A-t-elle vu un endocrinologue ?  La psychothérapie peut aider aussi mais il faut d'abord traiter la thyroïde.  Va voir le message que j'ai laissé à waves2211 aujourd'hui. J'explique comment je me suis guérie d'une hyperthyroïdie en suprimant le lait de vache de mon alimentation. Bonne chance à vous deux. rosemonde1;http://forum.doctissimo.fr/sante/thyroide-problemes-endocrinologiques/probleme-couple-tyroide-sujet_152716_1.htm
27/04/2006;tot34mg;Bonjour Fays, Je pense que tu lui as dit que tu la soutenais, mais redis lui encore, il n'y a rien de plus important pour une malade de la thyroïde en hyper, que d'être comprise par les gens qu'elle aime. Mon ex m'a dit que je faisais des manières, que c'était dans ma tête, c'est vrai c'est peut être une maladie dans ma tête (bien que mes pds sont véridiques elles!), mais je ne fais pas de manières, imagine que tu ne contrôle plus tes nerfs, que tu es à bout, à bout de force aussi, que tu ne dors plus alors tu stress en entendant les battements rapides de ton coeur, que tu n'arrive pas à te concentrer, tu perds tes cheveux, tu as tjrs faim... Bref tu n'en peux plus. Et là, les gens te repoussent, ne te comprennent pas, je crois qu'il n'y a rien de pire, mon ex s'appelle mon ex car il a pas était fouttu de comprendre et de faire attention à moi, il continuait de me tourmenter alors que j'étais mal, il m'a mis dans la tête que je pouvais guérir avec une bonne phylosophie, c'est vrai!!! Mais il était égoïste et malgrès mes efforts, les contrariétés qu'il me faisait m'ont fait perdre mon combat. ce que je veux dire, c'est que toi, tu as pigé qu'elle avait besoin d'amour, de soutien et que c'était très dur à vivre l'hyper. C'est ce que j'aurais aimé que mon entourage comprenne, j'aurais peut être gagné mon combat contre la thyroïde mais bon il ont préféré me voir rechutter 4 fois. Bravo à toi, c'est un beau geste d'amour;http://forum.doctissimo.fr/sante/thyroide-problemes-endocrinologiques/probleme-couple-tyroide-sujet_152716_1.htm
28/04/2006;fay41ft;...;http://forum.doctissimo.fr/sante/thyroide-problemes-endocrinologiques/probleme-couple-tyroide-sujet_152716_1.htm
28/04/2006;tot34mg;...???;http://forum.doctissimo.fr/sante/thyroide-problemes-endocrinologiques/probleme-couple-tyroide-sujet_152716_1.htm
29/04/2006;cin47pe;Bonsoir j'ai la maladie de basedow et mon concubin en souffre malheureusement.J'avais deja un caractere fort avant ca mais je crois que mon probleme de thyroide n'arrange rien.je m'enerve pour des broutilles, mon boulot me stresse souvent aussi et quand je rentre je lache tout sur mon concubin je sais c'est pas bien mais pas facile à controler.Il avraiment du courage et de la patience si j'etai à sa place je ne sai pa si je supporterai mes sautes d'humeur!Quand on se brouille je m'en veux car a chaque fois c'est pour n'importe quoi et j'en fai des montagnes.Apres je me sens ridiculesET enervee contre moi meme.Je le reconnais mais en meme temps si je ne me lache pas sur quelqu'un je ressent un mal etre.Mais le pauvre il y peu rien.j'avais besoin de parler de ca merci de me repondre et de me donner des conseils;http://forum.doctissimo.fr/sante/thyroide-problemes-endocrinologiques/probleme-couple-tyroide-sujet_152716_1.htm
02/05/2006;tot34mg;Bonjour Cindy, J'ai vécu 4 rechuttes de basedow et n'oublies pas que tu souffres aussi et plus que ton concubin...  En rechutte je ne me contrôlais plus, j'avais l'impression que je pouvais pêter un plomb à tous moment, je ne dormais plus, je gigotais comment si j'avais une crise de nerf, au travail, je ne pouvais plus bosser, plus me concentrer, j'avais envi de tout casser. Rosemonde a raison de te conseiller de prendre des avlocardyl, normalement avec le traitement on met un médicament dit Béta Bloquant censé soulager le coeur, comme Avlocardyl ou Tenromine. Dans mon cas, je fais de la sous tension alors j'étais toute flagada je faisais des malaises car bien que ça me soulagais ça faisait encore baisser ma tension. Je prend du Sympavagol, c'est un médicament aux plantes, je ne pense pas que ça fasse bcp d'effets lorsqu'on est en hyper mais quand le traitement au Néo a eu son effet ça aide a rester calme. Pour ton concubin, essayes de passer tes nerfs sur autres chose, va te dépenser tout en faisant bien attention à ton coeur car tu fais peut être de la takicardie avec ta maladie de Basedow. Prends des tisanes calmantes le soir, et ne t'inquiètes pas, il faut un peut attendre pour que le traitement fasse effet, mais tu vas aller de mieux en mieux et puis ton homme est là pour prendre soin de toi. Courage!;http://forum.doctissimo.fr/sante/thyroide-problemes-endocrinologiques/probleme-couple-tyroide-sujet_152716_1.htm
15/05/2006;fay41ft;...;http://forum.doctissimo.fr/sante/thyroide-problemes-endocrinologiques/probleme-couple-tyroide-sujet_152716_1.htm
15/05/2006;val08hi;Fays que tu veux tu dire avec .... ?????;http://forum.doctissimo.fr/sante/thyroide-problemes-endocrinologiques/probleme-couple-tyroide-sujet_152716_1.htm
15/05/2006;fay41ft;je veus que le debat reste d actualité;http://forum.doctissimo.fr/sante/thyroide-problemes-endocrinologiques/probleme-couple-tyroide-sujet_152716_1.htm
15/05/2006;Val28ku;Coucou tout le monde, moi je souffre de Hashimoto et mon mari lui aussi. C'est vrai que des fois c'est difficile avec cette maladie moi qui est déja stressée et nerveuse de nature et qui souffre de spasmophilie et d'attaque de panique je ne supporte plus grand chose, et des fois mon mari devient agressive et il a moins de patience l'avantage pour nous c'est que l'on sait d'ou cela vient, moi du coup j'évite de le contrarier mais lui des fois ne se rend pas toujours compte de son aggressivité donc des fois je craque et aprés çà va mieux, mais bon on a pas à se plaindre car nous nous aimons et donc tout s'arrange toujours et il faut dire que mon mari est plus agée que moi donc c'est sur que cela doit être encore plus génant pour lui. Par contre lui ne comprend pas toujours que je souffre de spasmophilie et d'attaques de panique, j'aime même pas pu passer le permis a cause de cela, du coup là j'ai une voiturette mais j'ai quand même par moment des petites attaques de panique même avec un traitement. Pourtant mon mari à déja était présent quand le médecin à expliqué ce que j'avais mais apparement mon mari n'a toujours rien compris pourtant il connait mon passé et l'origine de mes problémes. Je pense néanmoins que comme j'évite de montrer mon mal être il ne se rend pas compte dans l'état que je suis parfois, pourtant il a déja assisté à plusieurs attaques de panique et à pu voir dans quel état cela m'a mis. Peut être qu'il se cache la vérité je ne sais pas trop. Il ne se rend pas compte que pour moi même conduire ma voiturette reléve d'un gros travail sur moi et que je fais des attaques de panique atténuer certes par le traitement mais quand je rentre je suis épuisée car avoir tous les muscles qui se crispent se n'aient vraiment pas agréable. Mais bon le principal c'est que l'on s'entende. Voilà pour mon témoignage. Je vous souhaite une bonne journée.;http://forum.doctissimo.fr/sante/thyroide-problemes-endocrinologiques/probleme-couple-tyroide-sujet_152716_1.htm
15/05/2006;tot34mg;Coucou Val552, C'est étrange si ton mari souffre aussi d'Hashimoto et que ça lui fait faire du yoyo avec ses humeurs, il devrait comprendre ce qui se passe pour toi??? Je ne connais pas trop Hashimoto, mais ça a l'air aussi chiant que Basedow, on est jamais &amp #034 normal&amp #034  finalement, mais bon, ça fait ce que nous sommes aujourd'hui. Fays, comment vas tu? Tes problèmes de couples d'arrangent ils??? As tu suivi nos conseils? As tu modifié ton comportement et ton amie aussi?? Bon courage à vous!;http://forum.doctissimo.fr/sante/thyroide-problemes-endocrinologiques/probleme-couple-tyroide-sujet_152716_1.htm
15/05/2006;val08hi;Bonjour Val552, Je comprends que ton mari soit agressif et qu'il ait des sautes d'humeur: il est malade lui-meme et nous savons bien ce que Hashimoto peut faire sur l'humeur/le moral entre autres. Par contre tu pourrais essayer de lui expliquer que le fait que tu aies des crises d'angoisses parfois ne te rend pas &amp #034 différente&amp #034 . Tous les patients atteints d'Hashimoto n'ont pas forcément tous les memes symptomes et les memes réactions. Il faut aussi lui faire comprendre que rien que le fait d'etre une femme et donc d'etre sujette à des changements hormonaux réguliers, les périodes de creux peuvent etre accentués à cause de ça. La bonne chose est vous vous aimiez et que vous arriviez à bien vous entendre à la fin. Mais il est tout de meme important qu'il comprenne ce qui se passe. Bonne journée :);http://forum.doctissimo.fr/sante/thyroide-problemes-endocrinologiques/probleme-couple-tyroide-sujet_152716_1.htm
15/05/2006;ani76ed;bj  oui c est pas toujours facile elle nous prend tout moi aussi j aime mon homme mais j ai limpression de m eloigner j ai plus trop envie de parler sa me gave et pourtant il faut tenir  elle et vicieuse cette merde kon a en nous  pourtant j essaye de pas m ecouter mais c est tres dure bisou a tout le monde;http://forum.doctissimo.fr/sante/thyroide-problemes-endocrinologiques/hypothyroidie-sujet_171715_1.htm
15/05/2006;ani76ed;salut a toi fays je m'apelle stephen et moi aussi ma femme anita est atteinte de hashimoto je comprend ce que tu vit c'est dur mais il faut tenir moi par exemple je suis quelqun de tres calme meme si parfois j'ai envie de peter un steack mais je me controle j'essaie de trouver toute ses petites marque d'attention qui pourra lui permette d'oublier un peu cette mdr, je l'emmene en ballade en foret a la mer, je lui offre des fleurs, je lui fait des massage ca joue beaucoup les massage ca la detent, bref tout ses petit moment d'attention pour lui montrer que je suis la et que je la soutient il n'y a pas beaucoup d'homme comme nous car j'en connait beaucoup qui n'en n'ont rien a faire que leurs compagne souffre mais il faut se mettre a notre place meme si on est en bonne sante si notre moitie souffre nous on souffre deux fois plus mentalement car on se sent perdu on se pose plein de question sur notre amour moi je sait que mon amour est la bien ancre est ne risque pas de se decrocher et je serai a ses cote quoi qu'il arrive je te souaite bon courage et quant a ses sot d'humeur ne fait pas attention c'est a cause de cette connerie qui lui fait perdre la tete a toi de la faire revenir sans t'enerver tout doit ce faire dans le calme stephen l'homme de la vie d'anita;http://forum.doctissimo.fr/sante/thyroide-problemes-endocrinologiques/hypothyroidie-sujet_171715_1.htm
15/05/2006;val08hi;Coucou à toi Stephen, Et bien dis donc des fleurs, des ballades, des massages, ta femme a beaucoup de chance et cela doit beaucoup l'aider à supporter sa maladie. Je sais de quoi je parle.  Tu es vraiment un homme à épouser  ) Blague à part mon mari est comme ça aussi. Ah si tous les hommes pouvaient etre comme ça. La terre serait plus ronde. :) Bravo!;http://forum.doctissimo.fr/sante/thyroide-problemes-endocrinologiques/hypothyroidie-sujet_171715_1.htm
16/05/2006;ani76ed;bj c est anita oui c est un homme a epouser c est se que l ont va faire mais aura t il autant de patience dans kelke annee bonne journee;http://forum.doctissimo.fr/sante/thyroide-problemes-endocrinologiques/hypothyroidie-sujet_171715_1.htm
