date;user;text;url
11/01/2020;Steff94;Bonjour à tous, on m'a diagnostiqué la maladie d'Hashimoto (à 29 ans) il y a plus d'une semaine (j'ai encore du mal à me dire que c'est une maladie). A l'échographie, thyroïdite détectée  confrontée à une PSD, voici les résultats (je ne fais que réecrire ce que mon médecin a écrit puisque je n'y comprends rien): TSH : 48,785 Ac Anti TG : 54,6 Ac anti TPO : 229,4 TRAK: neg Apparemment tout est normal sauf la TSH qui est très élevée. RDV chez l'endocrinologue qui m'explique que je suis dans la phase définitive de l'hypothyroïdie, elle me met sous Lévothyrox 25, je n'habite même plus en France j'ai dû repousser mon billet pour pouvoir contrôler aux prochains examens médicaux. Ma question est, et désolée si elle a déjà été posée (j'ai navigué sur le forum et lu plein de choses intéressantes par ailleurs), est-ce normal que depuis la prise du traitement, j'ai l'impression que les symptômes ont empiré? ou est-ce simplement parce que j'étais avant dans le déni et qu'à partir du moment où j'ai su le problème, les symptômes se sont &amp #034 permis de se révéler&amp #034  davantage? ou est-ce le traitement? J'étais déjà assez fatiguée, mais j'ai toujours su gérer ma fatigue. Maintenant j'ai du mal, vraiment du mal. J'ai des crises de larmes quotidiennes, j'ai souvent très froid. J'ai perdu du poids, je n'ose même plus me peser. Je suis du genre à avoir la bougeotte, faire plein de choses, sortir... en ce moment je ne suis motivée à rien. Mon prochain RDV chez l'endocri n'est pas avant le mois prochain... Si quelqu'un a des réponses, je l'en remercie d'avance :);http://forum.doctissimo.fr/sante/thyroide-problemes-endocrinologiques/annonce-cortisol-smartphone-sujet_171788_1.htm
11/01/2020;Susanne in F;Et tu habites ou maintenant ?;http://forum.doctissimo.fr/sante/thyroide-problemes-endocrinologiques/annonce-cortisol-smartphone-sujet_171788_1.htm
11/01/2020;Steff94;En Australie depuis un an mais c'est temporaire (dans le cadre d'un PVT);http://forum.doctissimo.fr/sante/thyroide-problemes-endocrinologiques/annonce-cortisol-smartphone-sujet_171788_1.htm
11/01/2020;Susanne in F;Ca aurait été pour te conseiller un medecin qui s'y connait en hormones . En Australie j'ai des gens à ..... Adelaide , Melbourne , Sydney , Brisbane , et en Tasmanie . Desfois c'est plus facile d'en trouver ailleurs qu'en France . Ca fait combien de temps que tu prends 25 levothyrox ? Est-ce qu'ils ont controlé le cortisol ? Est-ce qu'ils ont fait les hormones thyroidiennes ?;http://forum.doctissimo.fr/sante/thyroide-problemes-endocrinologiques/annonce-cortisol-smartphone-sujet_171788_1.htm
11/01/2020;Steff94;Euh ben je pensais que les résultats que j'avais écrit concernaient les hormones thyroïdiennes ... Le cortisol non je ne crois pas. Je prends le Levothyrox 25 depuis 1 semaine seulement. En fait je suis en France actuellement je devais rentrer lundi en Australie donc j'ai actuellement une endocrinologue sur Paris. Je veux bien les coordonnées des médecins que tu as en Australie pour après.. merci beaucoup!;http://forum.doctissimo.fr/sante/thyroide-problemes-endocrinologiques/annonce-cortisol-smartphone-sujet_171788_1.htm
11/01/2020;petitbouch​on;Bonsoir Steff94 Ce qui compte surtout pour le levotyrox c'est la T4l serique puisque le levotyrox c'est de la T4 en comprimé. Le but c'est d'arriver à compenser pour avoir un dosage de T4l équivalent à ce que devrait produire la Thyroïde. C'est à priori constant toute la journée donc pas de problème pour compenser.;http://forum.doctissimo.fr/sante/thyroide-problemes-endocrinologiques/annonce-cortisol-smartphone-sujet_171788_1.htm
11/01/2020;Susanne in F;Il y a plusieurs possibilités . -- Quand on commence un traitement , la propre production du corps baisse . C'est normal . Il arrive que la propre production baisse plus que la quantité de medicament qui est ajouté par l'exterieur . Par example tu ajoutes 25 par l'exterieur , mais ton corps produit 40 de moins . Le resultat est que tu te sens plus mal qu'avant . -- Autre possibilité : beaucoup de gens qui ont un problème de thyroide ont aussi un problème des surrenales . Parce que les surrenales ont essayé de compenser pour la thyroide defaillante et ils sont epuisés . Quand tout à coup on met de la thyroide dans le corps , les surrenales epuisés ne peuvent pas le supporter et ils s'ecroulent completement . Ca peut etre ca aussi . Si c'est le premier cas , ca se traite en augmentant le levothyrox , enfin le medicament thyroide . Pour le 2e il faut faire une analyse cortisol pour savoir s'il y a un problème ou pas . A part ca il faut savoir que le Levothyrox est un medicaments de merde que beaucoup de patients ne supportent pas . Ca se trouve aussi que les problèmes viennent tout betement de la . Si tu veux que je te donne un medecin en Australie , il faut d'abord que tu me dises dans quel coin tu te trouves . Non les resultats que tu as ne concernent pas les hormones thyroidiennes . La TSH est une hormone hypophysaire qui a sa propre vie , et les autres resultats sont des anticorps pour detecter une maladie autoimmune . J'ai posé la question surtout pour voir quel niveau avait le medecin que tu vois en ce moment . S'il n'a pas fait les hormones thyroidiennes pour diagnostiquer un problème thyroidien , il a l'air de ne pas y connaitre grand chose . 99 % des medecins ne connaissent rien en hormones . Les endocrinologues ont une formation en diabète .;http://forum.doctissimo.fr/sante/thyroide-problemes-endocrinologiques/annonce-cortisol-smartphone-sujet_171788_1.htm
12/01/2020;petitbouch​on;Bonjour Steff94 Que vous soyez amenée à prendre des comprimés de thyroxine synthétique mélangée à un excipient qui fait varier son absorption, quelque soit la marque du médicament vendue dites vous que le principal médecin d'en l'affaire c'est vous et que le but c'est d'équilibrer la concentration de T4l et par dérivé de T3l que vous aurez dans le sang. La thyroxine est très fragile et afin qu'elle ne soit pas détruite il faut l'absorber à jeun avec un peu d'eau et attendre 30mn avant de prendre un petit déjeuner pour lui laisser le temps de passer dans le sang. Par contre il est nécessaire que vous passiez des examens pour voir quels sont les dégâts produits par les anticorps sur votre thyroïde. A votre âge vous n'aurez aucun problème pour vous faire suivre en France par un endocrinologue sérieux et je vous conseille de consulter dans un service d'endocrinologie d'un CHU. Ce forum, vous apprendra à maîtriser votre hypothyroïdie parce que nous partageons pour beaucoup le même problème. Bon courage;http://forum.doctissimo.fr/sante/thyroide-problemes-endocrinologiques/annonce-cortisol-smartphone-sujet_171788_1.htm
13/01/2020;Steff94;petitbouchon et @suzanne merci beaucoup pour vos réponses que j'ai mis un peu de temps à comprendre. Je me familiarise petit à petit avec toutes ces notions nouvelles et un peu effrayantes pour moi. Sous vos conseils j'ai pris RDV pour une demande de PDS concernant cortisol. L'endocrinologue que j'ai vu, contrairement au médecin traitant, m'a bien prescrit une ordonnance pour T4, TSH et NFS. Je ferais rajouter la T3 également...  petitbouchon que veux-tu dire quand tu dis que le propre médecin dans l'affaire c'est nous- même? Je vois bien que les médecins sont assez négligents , c'est pourquoi j'essaye de me renseigner de mon côté, mais je me vois mal intervenir dans mes dosages ou autre... Je lis actuellement deux livres qui me permettent de bien comprendre la maladie et les traitements naturels complémentaires afin de soulager les symptômes. J'espère que ça fonctionnera. Il y a des jours où j'ai l'impression d'être devenue dépressive alors que je suis plutôt de nature joviale ... C'est assez frustrant. Merci encore, prenez soin de vous. Stef;http://forum.doctissimo.fr/sante/thyroide-problemes-endocrinologiques/annonce-cortisol-smartphone-sujet_171788_1.htm
13/01/2020;Steff94;Une autre question, avec une telle fatigue, est-il bon de se forcer à faire certaines choses? On me propose de partir en vacance, est-ce raisonnable de partir ou vaut-il mieux se reposer? Car si je me repose chaque fois que je suis fatiguée, en gros je ne ferais que ça... je pense pas qu'il soit très bon de me laisser aller à la léthargie... mais encore une fois je n'en sais pas grand chose.;http://forum.doctissimo.fr/sante/thyroide-problemes-endocrinologiques/annonce-cortisol-smartphone-sujet_171788_1.htm
13/01/2020;bountykill​az;Coucou! Je suis comme toi Hashimoto. Levothyrox 25+1/2 de 25 tous les jours. Il faut savoir que la 1/2 vie du levo est d'une semaine. Donc au fur et à mesure des jours tu vas avoir un taux d'hormones de plus en plus important. Les bienfaits je les ai eu environ 15j après le début du traitement. Sois patiente ça va le faire! Moi je suis traitée depuis le mois de juin 2019 et je me sens parfaitement bien. J'ai un taux d'anticorps anti thyroglobuline très très très élevé mais la thyroïde fonctionne encore un peu. Tu feras ton bilan tous les 3 mois et on adaptera ton traitement t'inquiètes pas. Pour moi strictement aucun effet secondaire à part la perte de poids. Sinon ma peau est enfin nickel, je ne perds plus mes cheveux, je ne suis plus fatiguée, mes idées sont claires et le moral est au beau fixe! Tu vas voir tu vas aller mieux;http://forum.doctissimo.fr/sante/thyroide-problemes-endocrinologiques/annonce-cortisol-smartphone-sujet_171788_1.htm
13/01/2020;Steff94;"Coucou! Je suis comme toi Hashimoto. Levothyrox 25+1/2 de 25 tous les jours. Il faut savoir que la 1/2 vie du levo est d'une semaine. Donc au fur et à mesure des jours tu vas avoir un taux d'hormones de plus en plus important. Les bienfaits je les ai eu environ 15j après le début du traitement. Sois patiente ça va le faire! Moi je suis traitée depuis le mois de juin 2019 et je me sens parfaitement bien. J'ai un taux d'anticorps anti thyroglobuline très très très élevé mais la thyroïde fonctionne encore un peu. Tu feras ton bilan tous les 3 mois et on adaptera ton traitement t'inquiètes pas. Pour moi strictement aucun effet secondaire à part la perte de poids. Sinon ma peau est enfin nickel, je ne perds plus mes cheveux, je ne suis plus fatiguée, mes idées sont claires et le moral est au beau fixe! Tu vas voir tu vas aller mieux</span <span itemprop=""author"" itemscope itemtype=""https://schema.org/Person"" <span itemprop=""name"" hidden bountykillaz</span </span <span itemprop=""url"" hidden http://forum.doctissimo.fr/sante/thyroide-problemes-endocrinologiques/nouvelle-pays-hashimoto-sujet_171787_1.htm#t431710</span </span <span itemprop=""text"" hidden Coucou Bountykillaz, merci beaucoup pour ton message très rassurant, ca donne un peu de baume au coeur :)  la perte de poids est liée au traitement ? car apparemment en hypothyroïdie on a davantage tendance à prendre du poids plutôt qu'à en perdre de ce que j'ai compris. Bizarrement j'en perds aussi, l'endocrinologue m'a dit que j'avais les symptômes d'une hyper alors que je suis en hypo, que cela est dû à un dérèglement radical. Tu continues à perdre du poids même aujourd'hui? comment est ton appétit? Je suis déjà très fine, ça me fait vraiment bader de me dire que je vais continuer de maigrir mais bon il n'y a pas mort d'homme... Encore merci";http://forum.doctissimo.fr/sante/thyroide-problemes-endocrinologiques/annonce-cortisol-smartphone-sujet_171788_1.htm
13/01/2020;Eelf;"Coucou! Je suis comme toi Hashimoto. Levothyrox 25+1/2 de 25 tous les jours. Il faut savoir que la 1/2 vie du levo est d'une semaine. Donc au fur et à mesure des jours tu vas avoir un taux d'hormones de plus en plus important. Les bienfaits je les ai eu environ 15j après le début du traitement. Sois patiente ça va le faire! Moi je suis traitée depuis le mois de juin 2019 et je me sens parfaitement bien. J'ai un taux d'anticorps anti thyroglobuline très très très élevé mais la thyroïde fonctionne encore un peu. Tu feras ton bilan tous les 3 mois et on adaptera ton traitement t'inquiètes pas. Pour moi strictement aucun effet secondaire à part la perte de poids. Sinon ma peau est enfin nickel, je ne perds plus mes cheveux, je ne suis plus fatiguée, mes idées sont claires et le moral est au beau fixe! Tu vas voir tu vas aller mieux</span <span itemprop=""author"" itemscope itemtype=""https://schema.org/Person"" <span itemprop=""name"" hidden bountykillaz</span </span <span itemprop=""url"" hidden http://forum.doctissimo.fr/sante/thyroide-problemes-endocrinologiques/nouvelle-pays-hashimoto-sujet_171787_1.htm#t431710</span </span <span itemprop=""text"" hidden Bonjour, Vous souvenez-vous quels symptômes ont motivés les analyses/examens qui ont permis de diagnostiquer l'hypothyroïdie de Hashimoto? Merci Bonne continuation";http://forum.doctissimo.fr/sante/thyroide-problemes-endocrinologiques/annonce-cortisol-smartphone-sujet_171788_1.htm
13/01/2020;Steff94;Eelf pour moi c'était un goitre ressenti au palper;http://forum.doctissimo.fr/sante/thyroide-problemes-endocrinologiques/annonce-cortisol-smartphone-sujet_171788_1.htm
14/01/2020;bountykill​az;oui pour moi la perte de poids est directement associée au traitement. j'ai perdu 7 kilos en 6 mois... j'étais pas forcément en surpoids je me trouvais bien (70 kg pour 1m78) mais là je fais 63 et c'est pas génial. question appétit ? j'en ai pas. envie de rien. à part du café mais je n'ai plus faim du tout c'est triste mais c'est comme ça;http://forum.doctissimo.fr/sante/thyroide-problemes-endocrinologiques/annonce-cortisol-smartphone-sujet_171788_1.htm
14/01/2020;bountykill​az;alors ce qui a motivé le gynéco c'est une dysmorphie de la thyroïde simplement. après j'avais des symptômes flagrants de l'hypothyroïdie mais je pensais que c'était comme ça, qu'à 43 ans c'était normal d'être fatiguée, déprimée, d'avoir des pertes de cheveux, la peau très sèche et surtout des semelles en plomb. je n'avais strictement envie de rien et de rien faire. j'avais énormément de mal à parler, je cherchais mes mots, mes idées étaient confuses. je suis contente car j'ai tout récupéré, j'ai l'impression d'avoir 30 ans!!!;http://forum.doctissimo.fr/sante/thyroide-problemes-endocrinologiques/annonce-cortisol-smartphone-sujet_171788_1.htm
14/01/2020;petitbouch​on;"petitbouchon et @suzanne merci beaucoup pour vos réponses que j'ai mis un peu de temps à comprendre. Je me familiarise petit à petit avec toutes ces notions nouvelles et un peu effrayantes pour moi. Sous vos conseils j'ai pris RDV pour une demande de PDS concernant cortisol. L'endocrinologue que j'ai vu, contrairement au médecin traitant, m'a bien prescrit une ordonnance pour T4, TSH et NFS. Je ferais rajouter la T3 également...  petitbouchon que veux-tu dire quand tu dis que le propre médecin dans l'affaire c'est nous- même? Je vois bien que les médecins sont assez négligents , c'est pourquoi j'essaye de me renseigner de mon côté, mais je me vois mal intervenir dans mes dosages ou autre... Je lis actuellement deux livres qui me permettent de bien comprendre la maladie et les traitements naturels complémentaires afin de soulager les symptômes. J'espère que ça fonctionnera. Il y a des jours où j'ai l'impression d'être devenue dépressive alors que je suis plutôt de nature joviale ... C'est assez frustrant. Merci encore, prenez soin de vous. Stef</span <span itemprop=""author"" itemscope itemtype=""https://schema.org/Person"" <span itemprop=""name"" hidden Steff94</span </span <span itemprop=""url"" hidden http://forum.doctissimo.fr/sante/thyroide-problemes-endocrinologiques/nouvelle-pays-hashimoto-sujet_171787_1.htm#t431707</span </span <span itemprop=""text"" hidden Bonjour Stef Ce que je voulais dire, c'est que tu dois comprendre ce qu'est cette maladie pour la compenser correctement. Bien sûr tu dois attendre l'avis de l'endocrinologue pour modifier le traitement d'autant qu'il y a une inertie trop importante pour apprécier toute modification mais il faut que tu apprennes à comprendre les résultats des dosages sanguins du T4l et T3l. La TSH on s'en fiche puisque ce n'est plus l'hypophyse qui commande le dosage du fait des anti-TPO qui détruisent l'enzyme qui synthétise naturellement la T4. Elle n'indiquera au mieux qu'un excès ou une insuffisance de la concentration des deux hormones. Il faut aussi que tu te dises que correctement compensée il n'y a pas de raison que tous les symptômes maladifs soient à mettre sur ce problème. Il peut y avoir un intérêt à vérifier chez les parents et grands parents des maladies auto-immunes pour détecter une sensibilité héréditaire. En conclusion, la fatigue doit disparaître sinon continuer les recherches.";http://forum.doctissimo.fr/sante/thyroide-problemes-endocrinologiques/annonce-cortisol-smartphone-sujet_171788_1.htm
17/01/2020;Eelf;Merci pour vos réponses;http://forum.doctissimo.fr/sante/thyroide-problemes-endocrinologiques/annonce-cortisol-smartphone-sujet_171788_1.htm
20/01/2020;Steff94;petitbouchon  bonjour, pourquoi est-il mieux d'être suivi en CHU? merci d'avance :);http://forum.doctissimo.fr/sante/thyroide-problemes-endocrinologiques/annonce-cortisol-smartphone-sujet_171788_1.htm
21/01/2020;petitbouch​on;Bonjour Steff94 Les CHU développent des pôles de compétence pour suivre les patients qui passent dans leur service souvent après une arrivée par les urgences. Les médecins y pratiquent dans un espace d’étude, de recherche et de formation constante. Ils disposent des meilleurs outils pour ausculter et soigner leurs patients et n’hésitent pas à les adresser à divers confrères en interne pour des investigations complémentaires qui demandent les compétences d’une autre spécialité. Aller au CHU c’est contribuer à porter son cas à un système d’excellence de recherche lui donner le pouvoir de réclamer le financement pour le développement du plan santé auprès du ministère public et c’est contribuer à l’amélioration d’un outil de compétence moderne et futuriste pour la médecine d’aujourd’hui et de demain. Je suis habitant de la métropole nantaise et « la clinique d’endocrinologie du CHU de Nantes est centre de compétences pour toute les pathologies rares endocriniennes » et on ne peut que souhaiter que ce devienne une généralité pour tous les CHU de France.  https://www.chu-nantes.fr/endo -nutrition;http://forum.doctissimo.fr/sante/thyroide-problemes-endocrinologiques/annonce-cortisol-smartphone-sujet_171788_1.htm
22/01/2020;Steff94;petitbouchon merci pour ces explications, je suivrai tes recommendations. ma TSH est passée de 48 à 13 après une semaine sous lévothyrox25. Je me sens un peu moins fatiguée, mais ca dépend des jours, c'est surtout le réveil qui est difficile.;http://forum.doctissimo.fr/sante/thyroide-problemes-endocrinologiques/annonce-cortisol-smartphone-sujet_171788_1.htm
24/01/2020;Steff94;bountykillaz en combien de temps as tu trouvé le bon dosage du Levothyrox? Mon médecin traitant me dit de continuer sur du 25 car au bout d'une semaine la TSH est passée de 48 à 13, elle m'a dit que j'étais bien sensible au traitement. Mon endocrinologue me dit de passer à 1 comprimé + 1/2 ... J'ai peur de passer en dessous des normes. Je ne la vois pas avant la fin février. Elle n'avait pas l'air plus inquiète que ça. J'avais senti une évolution, moins fatiguée, de meilleure humeur mais ça n'a pas duré;http://forum.doctissimo.fr/sante/thyroide-problemes-endocrinologiques/annonce-cortisol-smartphone-sujet_171788_1.htm
25/01/2020;petitbouch​on;Bonjour Steff94 Ton médecin a-il peur de couler la SS pour ne demander qu'un dosage de la TSH ? Ce qui compte c'est l'accumulation de la T4l dans le sang avec la dose que tu prends tous les jours. TSH à 13mUI/l c'est énorme et la T4l doit être encore très basse. J'espère pour toi que tu vas faire une autre analyse rapidement. Pour les résultats d'analyse, le labo doit t'envoyer une copie ou te donner un code d'accès pour les consulter sur internet. P.S.A noter que la TSH est variable dans une journée contrairement à la T4l qui résulte d'une moyenne en fonction des apports.;http://forum.doctissimo.fr/sante/thyroide-problemes-endocrinologiques/annonce-cortisol-smartphone-sujet_171788_1.htm
27/01/2020;valentine;Hello steph Écoute ton endo qui te dit d’augmenter. Tsh 13 bien que mieux que 48 , tu as besoin de le baisser encore pas mal . C’est de la que ça vient tes symptômes. Les CHU ne font pas de suivi en matière de la thyroïde.;http://forum.doctissimo.fr/sante/thyroide-problemes-endocrinologiques/annonce-cortisol-smartphone-sujet_171788_1.htm
28/01/2020;Séverine45;Bonjour, moi je suis malade de la Thyroïde depuis l'âge de 11 ans, ça fait 18ans cette année que je suis suivis. En 2011 mon endocrino à commencé à me traiter avec du Levothyrox, j'ai commencé par 25 et je suis jusqu'à 175 pendant ma grossesse. Mes symptômes c'était 1 grande fatigué et souvent des douleurs un peu partout. Ma TSH est monté jusqu'à 5,78 je trouve ça déjà énorme alors Steph 13 la tienne est très très haute, continu le traitement elle diminue bien. Au début c'est assez contraignant et ensuite tu t'y fais, entre le traitement, les pds et tout les rdv.;http://forum.doctissimo.fr/sante/thyroide-problemes-endocrinologiques/annonce-cortisol-smartphone-sujet_171788_1.htm
12/01/2020;petitbouch​on;Bonjour A la Réunion annuelle de la Société internationale d'endocrinologie et de l'Endocrine Society à Chicago, ICE / ENDO 2014 un dispositif piloté par un smartphone permettant de faire une mesure du cortisol salivaire a été présenté.  https://diagnostic.santelog.co martphone/  Je ne sais pas si c'est pour ne pas avoir été approuvé par manque d'efficacité ou par manque de potentiel commercial du dispositif mais l'annonce semble avoir fait chou blanc car je ne trouve aucun site le proposant. Dommage parce que c'est mon principal problème de savoir quelle quantité prendre d'hydrocortisone. J'ai démarré avec 30 mg (20+10) puis me plaignant de difficultés à contrôler mon poids, mon endocrinologue m'a dit de baisser à 25 voire à 20mg. Au pire de ma prise de poids, je suis allé jusqu'à n'en prendre que 10 mg au pdj (3 à 4kg en moins en 10j) puis 10+5mg pdj,dj et actuellement 15+5mg donc c'est n'importe quoi et je n'ai absolument aucune idée de la courbe que peut faire mon cortisol sur 24h et la nuit ce n'est pas la joie pour dormir et j'ai à mon souhait 2 kg en trop   .;http://forum.doctissimo.fr/sante/thyroide-problemes-endocrinologiques/carence-importante-iode-sujet_171785_1.htm
12/01/2020;Susanne in F;Un problème de poids vient plutot de la thyroide que du cortisol . On a un bon poids quand toutes les hormones sont equilibrés . Avoir trop d'estrogène par rapport à la progesterone peut causer une prise de poids . Quand quelqu'un est deficient à la fois en thyroide et en cortisol , on est est obligé de commencer par le cortisol , sinon la thyroide n'est pas toleré . Le cortisol on peut donner tout de suite la bonne dose , tandis qu'en thyroide il faut commencer petit et augmenter progressivement . Il y a donc forcement un desequilibre au debut du traitement : pas assez de thyroide , ce qui peut causer une prise de poids temporaire . Cela s'arrange quand la personne aura atteint la bonne dose de thyroide . Tu souffres de quoi comme problème surrenal ? T'as eu un test au Synacthene ? Resultat ? Si tu as par example la maladie d'Addison , il faut remplacer le cortisol que ton corps ne produit plus . S'il s'agit d'une fatigue surrenale le traitement est très different . On donne une &amp #034 aide menagère&amp #034  à tes surrenales pendant un temps pour qu'ils aient moins de travail , tout en continuant à fonctionner . Comme ca ils peuvent se recharger . Tu peux poster tes chiffres thyroide ? Ca fait combien de temps que t'es en traitement ?;http://forum.doctissimo.fr/sante/thyroide-problemes-endocrinologiques/carence-importante-iode-sujet_171785_1.htm
