date;user;text;url
12/04/2019;valentine;1) hypothyroïdie cause la chute des cheveux 2) entre tsh et t4 et t3 , c’est t3 et t4 qui décide et non tsh . 3) je suis tout à fait d’accord avec ton médecin, j’aurais bien voulu l’avoir comme médecin. 4) ce médicament comme tu dis, est une hormone thyroïdiennes, Tout l’organisme est sous l’ordre de la thyroïde et si elle ne marche pas bien , le corps ne va pas bien . Enlever l’hormone thyroïdiennes à qcq qui en a besoin , au bout 6 mois c’est le coma . Ce n’est absolument pas un médicament de confort , c’est un médicament indispensable. Mais tu ne t’en rend pas compte car tu en es au début de la maladie .;http://forum.doctissimo.fr/sante/thyroide-problemes-endocrinologiques/t3-normal-anticorps-sujet_171648_1.htm
12/04/2019;</b>;Vous avez sûrement raison Valentine. Je vais reprendre un rdv avec mon docteur (car c'est la secrétaire en plus qui m'a dit ca) et lui demander, qu'il m'explique les résultats et le fonctionnement de ces médicaments et voir, si avec des méthodes plus naturelle, il est possible de réduire les effets et/ou la dose. Je ne souhaite pas prendre de risques.;http://forum.doctissimo.fr/sante/thyroide-problemes-endocrinologiques/t3-normal-anticorps-sujet_171648_1.htm
13/04/2019;valentine;Oui ok bon courage Mais il existe aucun traitement naturel . Mais un entretien avec ton médecin est nécessaire. Je pense que ne pas prendre le traitement pour que ton médecin a donné est de prendre un grand risque . En tout cas prends toi en main et si tu as besoin de nous , avec plaisir. Bon courage et bonne chance;http://forum.doctissimo.fr/sante/thyroide-problemes-endocrinologiques/t3-normal-anticorps-sujet_171648_1.htm
13/04/2019;lapsang;Bonjour, Tout à fait d'accord avec Valentine : le traitement ne doit surtout pas être arrêté. Les hormones thyroïdiennes sont indispensables pour vivre. C comme l'insuline pour les diabétiques. Et le bon réflexe est de questionner le médecin sur ce choix étrange. Comme je te l'ai dit , j'étais dans le même cas que toi avec une tsh effondrée et le doc a baissé mon dosage de levothyrox. Ma pharmacienne m'a demandé pourquoi on me changeait mon dosage et lorsque je lui ai dit, elle m'a dit que c'était logique. Idem pour une de mes cousines qui est aussi hashimoto et qui est aussi de plus pharmacienne : je l'ai interrogée et elle m'a dit que baisser mon dosage était normal et logique sinon j'allais me retrouver en grosse hyperthyroïdie provoquée par un excès d'hormones de synthèse et c'est vrai que j'avais déjà des symptômes. Mais dans ton cas, il y a peut-être d'autres éléments qui ont amenés le doc à faire ce choix...sauf qu'il faudrait qu'il te l'explique. Malade ou pas on a tous un cerveau qui se pose des questions et qui peut comprendre non ? Dis-nous quelles explications tu as obtenues, ça serait intéressant de savoir. Bon courage surtout !;http://forum.doctissimo.fr/sante/thyroide-problemes-endocrinologiques/t3-normal-anticorps-sujet_171648_1.htm
15/04/2019;Cecily83;bonjour Vanille, mon avis, puisque vous demandez des avis : je suis tout à fait d'accord avec valentine et votre médecin, vous avez de la chance d'avoir un médecin moderne . Les médecins qui traitent l'hypothyroidie en suivant la TSH sont des docs qui ont 30 ans de retard . Voici : AVANT de prendre des hormones, une TSH très basse indique un hyperthyroidie. APRES avoir commencé le traitement , la TSH n'indique plus rien du tout et n'a plus d’intérêt pour se soigner, on peut même avoir une TSH à 0 sans aucun symptomes de l'hyper (même si ça ferait peur à certains docs, les ignorants, ceux qui ne lisent jamais la recherche ni même les publications internationales / l'ignorance c'est terrible) Les vieilles idées sont dures à évoluer... Vous avez la sensation d'aller de plus en plus mal tout simplement parce que vous êtes sur une dose trop petite pour vous et sous traitée   l'important c'est la LT4 et LT3, si vous étiez en hyper vous seriez au dessus des normes et vous n'auriez pas des symptomes d'hypo. L’hypothyroïdie ne se soigne pas avec un traitement naturel et il faut un traitement à vie Si vous perdez plus de cheveux, c'est tout simplement parce que votre hypothyroidie s'aggrave et que vous avez besoin de plus d'hormones pour bien vous soigner. Je vous souhaite bon courage et soignez vous bien.;http://forum.doctissimo.fr/sante/thyroide-problemes-endocrinologiques/t3-normal-anticorps-sujet_171648_1.htm
15/04/2019;</b>;Bonjour tout le monde et merci pour vos réponses, Je comprends ce tout à fait ce que vous voulez dire, le problème c'est dans un premier temps, que c'est la secretaire du médecin de remplacement qui m'a dit ca, et le médecin il signe simplement la prescription. Ce qui me fait m'interroger, c'est que mes symptomes se sont empirés depuis le traitement et ensuite l'augmentation de la dose. De plus, a aucun moment, mes anticorps, Vitamine D, taux de zinc, Selenium, Cortisol, Iode, fT3, FT4 dans les urines... etc on été vérifié. Du coup je me demande si c'est pas plutôt un pbl de thyroide fonctionnelle, que j'ai des syptomes d'hypo, car mon corps ne transforme pas bien la T4 en T3 par exemple... Je suis végétarienne, donc je sais que mon taux de Zinc, ou de fer ou même d'iode peu souvent être bas. Aussi, j'ai un boulot relativement stressant pour l'organisme, du coup je me dis que ca pourrai aussi venir des glandes surrénales. Bref, il me semblerait interessant de savoir également du coup, si c'est la thryoide qui est malade, ou si elle ne fonctionne pas correctement dû à d'éventuelles carences dans l'organisme, qui pourraient simplement être résolues. Je vous remercie de vos réponses et vous tiendrais au courant. :-);http://forum.doctissimo.fr/sante/thyroide-problemes-endocrinologiques/t3-normal-anticorps-sujet_171648_1.htm
15/04/2019;lapsang;Bonjour, Toute expérience personnelle est forcément relative et ne vaut pas généralité. Mais j'espère que tu nous donneras des nouvelles car je suis dans le même cas que toi, je me pose beaucoup de question sur ces PB de Thyroide. On ne peut pas tenir compte exclusivement du taux de TSH et les dernières reco de L'ansm vont dans ce sens depuis l'affaire du Levothyrox : il faut aussi prendre en compte le taux d'hormones thyroidiennes circulant dans le sang et des symptômes présentés ou non par les patients et sans doute aussi du stade de la maladie et de son évolution ou pas. Je m'explique Il y a 15 ans j'ai fait une phase d'hypothyroidie lègère. Zéro traitement. Repos et éloignement d'un contexte de travail hyper stressant. Le fonctionnement thyroidien s'est rétabli. Il y a 8 ans re-belote, le taux de TSH dépasse les normes hautes. Refus de prise en compte par le médecin (j'étais une vraie carpette pourtant) Arrêt de travail de plus de 3 mois....et tout est revenu à la normale. Il y a Deux ans ça recommence ...pendant un an analyses normales (mais évidemment juste analyse TSH) Au bout d'un an TSH à plus de 120 (pour norme à 4,5 max). Mise sous traitement levothyrox et propanolol .Il y a 2 mois taux de TSH à 0,1 et le médecin me baisse direct le levothyrox. J'étais pas trop pour car je ne sentais aucun symptômes sauf les insomnies qui revenaient et le doc me dit &amp #034 votre thyroide n'a pas due être trop abimée elle fonctionne normalement et si ça se trouve dans 3 mois vous pourrez arrêter complètement le traitement...J'étais bouche bée...Tout ceci dans un contexte clair d'Hashimoto (anticorps présents, contexte d'antécédents familiaux). Là Je ne suis plus qu'à 25µg de Levo et je pète la forme...et même beaucoup trop ....) Donc je pense qu'arriver à doser correctement quelqu'un qui a hashimoto est bien plus complexe que pour les personnes qui ont eu une ablation de la Thyroide...) On a une glande qui reste fonctionnelle et dont le fonctionnement évolue. Je crois que la leçon de tout cela reste 1/ Les analyses complètes avec TSH et T3 T4 et mon doc ne me fait pas faire les T3 T4 mais je vais le faire faire toute seule 2/ l'existence ou pas de symptômes que l'on soit ou pas dans la norme....Par ailleurs Je suis comme toi végétarienne depuis plus de 20 ans et Le médecin remplaçant que j'ai vu la dernière fois m'a prescrit des analyses ultra complètes pour voir si je ne manquait de rien de ce côté ....Vais les faire avec les T3 Et T4..... Bonne journée !;http://forum.doctissimo.fr/sante/thyroide-problemes-endocrinologiques/t3-normal-anticorps-sujet_171648_1.htm
15/04/2019;valentine;Mon médecin me dit regardez il n’y a plus d’anticorps, tsh trop bas, faut baisser le traitement.voir arrêter  Je lui dis plus d’anticorps ne vaut pas dire , ça y est hashimoto c’est fini ! Une maladie auto-immune .. en revanche ça peut vouloir dire il n’y a plus de thyroïde à attaquer ! C’est incroyable que ce soit moi qui doit guider mon médecin ! Qui par ailleurs est compétent dans les autres domaines. De toute façon, je ne baisserais pas .;http://forum.doctissimo.fr/sante/thyroide-problemes-endocrinologiques/t3-normal-anticorps-sujet_171648_1.htm
15/04/2019;</b>;Rebonjour, Alors comme pour avoir un rdv ici, il faut attendre des mois. (Le generaliste qui suite a une grosse fatigue m’avait prescrit du thyranojod 50) n’a pas de places avant le 29 Aout, et celui qui m’a dit de passer à 75 est en congés pour 3 semaines. On à le temps de mourrir...) Je suis allée ce matin chez une généraliste, qui est très bien noté. Elle a regardé mes derniers résultats qui datent d’Octobre, ceux que j’ai partagé avec vous, était aussi choquée de ma perte de cheveux et m’a dit de ne surtout pas augmenter et au contraire qu’elle pense qu’il faudrait diminuer. Elle m’a fait une prise de sang pour l’analyse du TSH, T3, T4 mais aussi anti-corps (ce qui n’a jamais été fait à présent) et m’a aussi fait une écho de la thyroide , qui n’avait également jamais été faite. D’après elle, il n’y a rien de suspicieux à l’echo, elle est juste un peu petite, mais me présente aucun nodules. Resultats de ma prise de sang normalement jeudi.;http://forum.doctissimo.fr/sante/thyroide-problemes-endocrinologiques/t3-normal-anticorps-sujet_171648_1.htm
16/04/2019;lapsang;Hello, @vanille-Noisette, contente que tu aies pu trouver au moins une généraliste qui semble vouloir faire des examens plus complets. Je vois qu'il n'est pas plus simple de trouver un doc en Allemagne que dans certains coins de France. Tiens nous au courant pour les résultats, c'est toujours intéressant de savoir !!! et bon courage. Pour info, Je crois qu'il m'a fallu attendre plus de 8 mois pour que ma perte de cheveux se calme, et qu'ils recommencent à repousser. Pour les autres symptômes C'est plus variable. @Valentine, si seulement cela pouvait être vrai : plus d'anticorps = guérison. J'attends aussi de pied ferme mon prochain RV généraliste puisque avant je dois faire le détour par la case labo d'analyses et que je vais faire faire mes tx de T3 et T4 de ma poche, qui, selon lui sont &amp #034 inutiles à doser&amp #034  le seul instrument valable de pilotage étant la &amp #034 tsh&amp #034  . Il faudrait que j'arrive à retrouver le texte de l'ansm et les nouvelles recommandations de suivi des patients ayant des PB de Thyroide ! Bonne journée :);http://forum.doctissimo.fr/sante/thyroide-problemes-endocrinologiques/t3-normal-anticorps-sujet_171648_1.htm
18/04/2019;</b>;  Petite mise à jour après les résultats du labo.    Donc ma TSH était encore descendu depuis la dernière analyse, et ce, sans avoir changé le dosage. Alors que mon précédent médecin, qui m'avait prescrit ce médicament ainsi que de la Vitamine D (suite à une carence de celle-ci) m'avait dit que je devais &amp #034 ENCORE&amp #034  augmenter les doses ! Les résultats, mon ressentit, ainsi que le médecin actuel, me dit que c'est archi faux, qu'il faut au contraire les diminuer et qu'à la base je n'en ai pas besoin ! J'aurai démontré un signe de thyroïdie fonctionnelle à une époque suite à une carence en Vitamine D, mais la thyroïde sinon en soi fonctionnait très bien ! Aussi, en me disant de continuer à prendre ce médicament et augmentant les doses (sans jamais avoir fait d'écho ou de test spécifiques, je le répète) et ce pendant plusieurs années. Mes symptômes s'aggravaient, mais ils étaient provoqué par ce médicament, que je n'aurai pas du prendre ! Ma thyroïde est un peu plus petite que la normale, et toujours d'après mon docteur, c'est du au fait, que j'ai pris des hormones pendant plus de trois ans dont mon corps n'avaient pas besoin, donc elle a commençait doucement à se mettre au repos! Elle m'a donc dire que nous allions pouvoir arrêter ce médicament, mais qu'il fallait diminuer les doses progressivement, afin de la laisser se remettre en route doucement. Lorsqu'elle a me demander de confirmer le nom du médicament, je lui ai rappelé, que ce n'était pas celui-ci mais Thyronajod-Henning . Elle était choqué et m'a demandé de confirmer à deux reprises. Ce médicament est certes pour les personnes en hypothyroidie (ce qui n'est pas mon cas) mais en plus réservé aux personnes qui ont des nodules à tendance cancéreuse!    C'était pour moi le ponpon! j'étais chez le coiffeur, nous étions tous les deux choqués! Donc suite à une carence en Vitamine D, on me diagnose une hypothiroidie (sans même faire d'écho ou de test précis), on me donne un même médicament pendant 3 ans, en me faisant augmenter les doses quand je dis que je ne vais pas mieux, ce médoc est pour les nodules cancéreux et moi j'ai rien... mais pendant tout ce temps là, ca me rend mal, et ca commence a atrophier ma thryoide ! Je suis dans un état, vous ne pouvez pas imaginer! Heureuse de savoir que je n'ai rien au final, mais quand je pense que c'est cette ** qui me rendait malade et qui commençait a atrophier ma thyroïde !  Donc je remercie ma perte de cheveux, qui m'a vraiment mis la puce à l'oreille sur ce que je mettais ou pas dans mon corps et à me diriger vers ce médicament, qui m'a était prescrit à tord !;http://forum.doctissimo.fr/sante/thyroide-problemes-endocrinologiques/t3-normal-anticorps-sujet_171648_1.htm
18/04/2019;valentine;Vanille tiens nous au courant au fur et à mesure . Je ne suis pas médecin. Peut-être avant de te lancer , ton médecin aurait pu juste faire une recherche d’anticorps, et une échographie. Car si tu n’as jamais fait ces deux examens, après les résultats, tu pourras ensuite commencer à diminuer, le médecin que tu viens de voir non plus n’a jamais fait ces examens. En tout cas si c’est vraiment le cas , et que tu n’as rien , je suis contente pour toi . C’est marrent à peu de chose près , mes résultats ressemblent au tiens .;http://forum.doctissimo.fr/sante/thyroide-problemes-endocrinologiques/t3-normal-anticorps-sujet_171648_1.htm
18/04/2019;</b>;Bonsoir Valentine, Si, ces tests ont été fait par mon nouveau (il u a 3 jours) : échographie, recherche d anticorps, T3, T4, TSH.. la totale! Il était d’ailleurs choqué que mon 1er medecin n’ai jamais fait les anti-corps ou une echographie. Maintenant je vais pouvoir diminuer les doses et faire de mon mieux pour supporter ma thyroide afin qu’elle reprenne son rôle pleinement. .;http://forum.doctissimo.fr/sante/thyroide-problemes-endocrinologiques/t3-normal-anticorps-sujet_171648_1.htm
18/04/2019;valentine;Ok alors bonne route Tiens nous au courant;http://forum.doctissimo.fr/sante/thyroide-problemes-endocrinologiques/t3-normal-anticorps-sujet_171648_1.htm
19/04/2019;lapsang;Bonjour Vanille, ton histoire est très intéressante et très instructive et je te remercie d'avoir pris la peine de la partager ! Il est effectivement plus que stupéfiant de voir le suivi que font certains médecins et pas si rare que ce que l'on peut croire...Mes problèmes de thyroide ont pour ma part commencés en décembre 2015 et j'ai été diagnostiquée seulement en mars 2018...entre temps j'ai été soignée pour une angine virale persistante (j'avais un peu mal à la gorge et j'étais épuisée), puis pour un reflux gastrique (je ne digérais plus rien et j'avais sans cesse le hoquet) puis pour une ....candidose buccale....(langue blanche et toujours gêne à la gorge en déglutissant) tout cela sans AUCUN examen. Je voyais bien que ces traitements ne marchaient pas. Mais mon médecin a commencé à suggérer que c'était peut-être dans la tête (ah ben oui forcement une bonne femme qui se plaint !) Puis j'ai dû aller voir un médecin remplaçant pour un PB mineur (cheville foulée) et là il a constaté que j'avais un problème bien plus grave d'hypertension (17 à l'époque), de tachycardie et d'arythmie cardiaque. J'ai alors &amp #034 osé&amp #034  reparler de tous mes symptômes. Il ne m'a donné aucun traitement en immédiat mais m'a mis directement au repos en arrêt maladie et m'a fait faire des examens. J'avais Une TSH à plus de 120 et une fonction cardiaque complètement dérégulée à cause d'une grave hypo non diagnostiquée ....mon médecin traitant avait bien vu que j'avais de la tension mais pour lui c'était pas grave....Avec tous les examens en main le nouveau doc m'a alors prescrit du Levothyrox. il m'a dit qu'il fallait tout de suite mettre ma thyroide au repos Par contre là aussi il y a 2,5 mois il a recommencé à baisser mon dosage de LEVO car ma TSH était à 0,1...j'étais pas trop pour car je n'avais pas de symptômes a part des insomnies qui revenaient et du coup de la fatigue de jour et j'étais très étonnée car il m'a dit également que j'allais peut-être pouvoir arrêter le traitement...: Pour lui ma thyroide est toujours fonctionnelle, elle n'a pas été encore &amp #034 trop abimée&amp #034  par les anti-corps. Verdict bientôt car je dois aussi aller faire une PDS et je vais demande le dosage de la T4 en plus .... Comme quoi faut effectivement écouter son corps et aussi réussir à se faire écouter par les médecins !!!;http://forum.doctissimo.fr/sante/thyroide-problemes-endocrinologiques/t3-normal-anticorps-sujet_171648_1.htm
19/04/2019;valentine;N’oublie pas le t3;http://forum.doctissimo.fr/sante/thyroide-problemes-endocrinologiques/t3-normal-anticorps-sujet_171648_1.htm
19/04/2019;lapsang;valentine Bonjour, J'ai fait faire ma PDS ce matin et j'ai demandé la T4 libre en plus (que la dame du labo m'a pas fait payer : elle a juste rajouté sur l'ordo à la main). Je n'ai donc pas demandé la T3 et je m'explique : j'ai été voir sur différents sites, dont celui de la HAS et à page des nouvelles reco de suivi des patients Thyroidiens : aujourd'hui suite à l'affaire du Levothyrox la HAS préconise ce dosage de T4 pour pouvoir affiner le diagnostic en cas de TSH en dehors des normes et vérifier l'étendue du dysfonctionnement. Or la T4 libre représente 80% des hormones thyroidiennes et permet donc à elle seule de quantifier ce dysfonctionnement. Cela m'a semblé logique de ne demander que le dosage de la T4 libre. Mais c'est vrai que déjà je n'aurai pas eu l'idée de demander spontanément la T4. Voili-Voilou...résultats ce soir. Je pense qu'avec seulement 25µG de Levo, je suis à nouveau en HYPER, je reste toute la nuit les yeux grands ouverts bien que je me sente fatiguée....grosses insomnies et du coup le jour je me traine. Après on va bien voir si je suis en hyper parce que ma thyroide fonctionne encore assez bien et qu'avec le Levo en plus ça fait trop, ou alors si la baisse du dosage fait que mon cerveau se met à relancer beaucoup trop la thyroide qui s'emballe à nouveau. Je sais juste que j'ai un symptôme qui a disparu : la sensation permanente d'avoir une balle de ping-pong coincée au fond de la gorge... c'est beaucoup moins sensible. Les anti-corps se sont calmés et ma thyroïde est moins enflammée ? Ah et pour rire sur nos amis médecins : la sécu s'est rendue compte (toujours suite à l'affaire du levo) que 30% des initiations de traitement de substitution sont faites sans AUCUNE analyse préalable: même pas la TSH ...t'es plus toute jeune, t'es une femme, tu perds tes cheveux et t'es fatiguée : allez hop un petit coup de Levo et ça repart ....et du coup c'est comme pour Vanille-noisette, les gens sont traités pour quelque chose qu'ils n'ont pas... Bonne journée !;http://forum.doctissimo.fr/sante/thyroide-problemes-endocrinologiques/t3-normal-anticorps-sujet_171648_1.htm
19/04/2019;valentine;T4 c’est l’hormone thyroïdiennes genre de la nourriture dans les placards T3 l’hormone prête à l’emplois genre nourriture dans l’assiette De plus il y a des gens qui ont un bon taux de t4 mais qui ne la transforme pas correctement en t3. Boule de Ping Pong dans la gorge = hypothyroïdie;http://forum.doctissimo.fr/sante/thyroide-problemes-endocrinologiques/t3-normal-anticorps-sujet_171648_1.htm
19/04/2019;lapsang;Bonjour Valentine, Bien reçu ton message. Je te joins ci-dessous la mise à jour qui date de ce mois des préco de prise en charge des patients thyroidiens de la HAS, base sur laquelle j'ai délibérément choisi de ne faire faire que la T4 libre en plus :  Diagnostic   Dans le diagnostic initial d’une hypothyroïdie, il n’y a pas lieu de prescrire un dosage de T3L.  Le diagnostic biologique initial d’une hypothyroïdie est basé sur le dosage de la TSH et de la T4L. L’intérêt du dosage de la T3L dans le diagnostic initial d’une hypothyroïdie n’est pas démontré. De plus, ce dosage expose à des explorations, voire des traitements inutiles en cas d'abaissement isolé de la T3L   ce syndrome de « basse T3 » est fréquent au cours de certains états pathologiques et chez les sujets dénutris et ne traduit pas un dysfonctionnement thyroïdien.  https://www.has-sante.fr/porta othyroidie  Par contre si effectivement je n'ai plus cette sensation de balle de ping pong dans la gorge qui signale une HYPO ça veut dire que mon doc avait raison et que ma thyroidie n'a pas trop souffert, fonctionne toujours bien et que je pourrais abandonner au moins temporairement le Levothyrox, ce qui m'avait semblé stupéfiant ! Verdict avec la PDS !;http://forum.doctissimo.fr/sante/thyroide-problemes-endocrinologiques/t3-normal-anticorps-sujet_171648_1.htm
19/04/2019;valentine;Les autorités de santé disent beaucoup de chose , mais la thyroïde est très spéciale.il y a peu de médecin dans le monde , je dis bien le monde , qui peuvent traiter correctement la thyroïde. Tu ne me crois pas Ask Suzanne !;http://forum.doctissimo.fr/sante/thyroide-problemes-endocrinologiques/t3-normal-anticorps-sujet_171648_1.htm
19/04/2019;</b>;En effet pour ma part c’est cette carence qui fait que je convertissais mal la T4 en T3 et avais aussi des pbl a l assimiler suite a d’autres mineraux. Le plus important a retenir, c’est ecouter votre corps! Comme dit, je suis au finale tellement reconnaissante de cette perte de cheveux, qui m’a permis de vraiment creuser plus d’où venait tous ces problèmes. (Bon maintenant, faut que les cheveux repoussent );http://forum.doctissimo.fr/sante/thyroide-problemes-endocrinologiques/t3-normal-anticorps-sujet_171648_1.htm
19/04/2019;valentine;Vanille Ne te réjouis pas trop vite non plus , car baisser le traitement en attendant que ta thyroïde prenne le relais , c’est pas une partie de plaisir, tu vas passer par des phases de hypo, assez fatiguante  Mais bon ton médecin t’aidera . Mais juste viens nous dire comment ça se passe , ça nous intéresse ça peut nous servir si ça nous arrive .;http://forum.doctissimo.fr/sante/thyroide-problemes-endocrinologiques/t3-normal-anticorps-sujet_171648_1.htm
19/04/2019;</b>;Oui Valentine, justement je vais essayer de la supporter du mieux que je peux en me supplementant à côté (zinc, vit D, etc...) et en me reposant. Je vous tiendrais au courant;http://forum.doctissimo.fr/sante/thyroide-problemes-endocrinologiques/t3-normal-anticorps-sujet_171648_1.htm
19/04/2019;valentine;Ok merci bonne route;http://forum.doctissimo.fr/sante/thyroide-problemes-endocrinologiques/t3-normal-anticorps-sujet_171648_1.htm
